"No.","Time","Source","Destination","Protocol","Length","Info"
"1","0.000000","::1","::1","PGSQL","259",">Q"
"2","0.000156","::1","::1","TCP","64","5432  >  49674 [ACK] Seq=1 Ack=196 Win=8250 Len=0"
"3","0.001100","::1","::1","UDP","340","49667  >  49667 Len=288"
"4","0.001304","::1","::1","PGSQL","115","<T/C/Z"
"5","0.001467","::1","::1","TCP","64","49674  >  5432 [ACK] Seq=196 Ack=52 Win=8396 Len=0"
"6","5.048385","::1","::1","PGSQL","259",">Q"
"7","5.048636","::1","::1","TCP","64","5432  >  49674 [ACK] Seq=52 Ack=391 Win=8249 Len=0"
"8","5.049702","::1","::1","UDP","340","49667  >  49667 Len=288"
"9","5.049918","::1","::1","PGSQL","115","<T/C/Z"
"10","5.050034","::1","::1","TCP","64","49674  >  5432 [ACK] Seq=391 Ack=103 Win=8395 Len=0"
"11","10.114446","::1","::1","PGSQL","259",">Q"
"12","10.114615","::1","::1","TCP","64","5432  >  49674 [ACK] Seq=103 Ack=586 Win=8248 Len=0"
"13","10.115823","::1","::1","UDP","340","49667  >  49667 Len=288"
"14","10.116093","::1","::1","PGSQL","115","<T/C/Z"
"15","10.116237","::1","::1","TCP","64","49674  >  5432 [ACK] Seq=586 Ack=154 Win=8395 Len=0"
"16","15.168888","::1","::1","PGSQL","259",">Q"
"17","15.169120","::1","::1","TCP","64","5432  >  49674 [ACK] Seq=154 Ack=781 Win=8247 Len=0"
"18","15.170705","::1","::1","UDP","340","49667  >  49667 Len=288"
"19","15.171006","::1","::1","PGSQL","115","<T/C/Z"
"20","15.171202","::1","::1","TCP","64","49674  >  5432 [ACK] Seq=781 Ack=205 Win=8395 Len=0"
"21","20.212460","::1","::1","PGSQL","259",">Q"
"22","20.212610","::1","::1","TCP","64","5432  >  49674 [ACK] Seq=205 Ack=976 Win=8246 Len=0"
"23","20.213556","::1","::1","UDP","340","49667  >  49667 Len=288"
"24","20.213752","::1","::1","PGSQL","115","<T/C/Z"
"25","20.213852","::1","::1","TCP","64","49674  >  5432 [ACK] Seq=976 Ack=256 Win=8395 Len=0"
"26","25.244086","::1","::1","PGSQL","259",">Q"
"27","25.244223","::1","::1","TCP","64","5432  >  49674 [ACK] Seq=256 Ack=1171 Win=8246 Len=0"
"28","25.245078","::1","::1","UDP","340","49667  >  49667 Len=288"
"29","25.245311","::1","::1","PGSQL","115","<T/C/Z"
"30","25.245417","::1","::1","TCP","64","49674  >  5432 [ACK] Seq=1171 Ack=307 Win=8395 Len=0"
"31","30.299748","::1","::1","PGSQL","259",">Q"
"32","30.299914","::1","::1","TCP","64","5432  >  49674 [ACK] Seq=307 Ack=1366 Win=8245 Len=0"
"33","30.300847","::1","::1","UDP","340","49667  >  49667 Len=288"
"34","30.301058","::1","::1","PGSQL","115","<T/C/Z"
"35","30.301196","::1","::1","TCP","64","49674  >  5432 [ACK] Seq=1366 Ack=358 Win=8394 Len=0"
"36","35.370116","::1","::1","PGSQL","259",">Q"
"37","35.370274","::1","::1","TCP","64","5432  >  49674 [ACK] Seq=358 Ack=1561 Win=8244 Len=0"
"38","35.371368","::1","::1","UDP","340","49667  >  49667 Len=288"
"39","35.371593","::1","::1","PGSQL","115","<T/C/Z"
"40","35.371713","::1","::1","TCP","64","49674  >  5432 [ACK] Seq=1561 Ack=409 Win=8394 Len=0"
"41","40.416015","::1","::1","PGSQL","259",">Q"
"42","40.416184","::1","::1","TCP","64","5432  >  49674 [ACK] Seq=409 Ack=1756 Win=8243 Len=0"
"43","40.417033","::1","::1","UDP","340","49667  >  49667 Len=288"
"44","40.417201","::1","::1","PGSQL","115","<T/C/Z"
"45","40.417300","::1","::1","TCP","64","49674  >  5432 [ACK] Seq=1756 Ack=460 Win=8394 Len=0"
"46","45.468855","::1","::1","PGSQL","259",">Q"
"47","45.469044","::1","::1","TCP","64","5432  >  49674 [ACK] Seq=460 Ack=1951 Win=8243 Len=0"
"48","45.470178","::1","::1","UDP","340","49667  >  49667 Len=288"
"49","45.470443","::1","::1","PGSQL","115","<T/C/Z"
"50","45.470570","::1","::1","TCP","64","49674  >  5432 [ACK] Seq=1951 Ack=511 Win=8394 Len=0"
"51","50.513973","::1","::1","PGSQL","259",">Q"
"52","50.514120","::1","::1","TCP","64","5432  >  49674 [ACK] Seq=511 Ack=2146 Win=8242 Len=0"
"53","50.515162","::1","::1","UDP","340","49667  >  49667 Len=288"
"54","50.515403","::1","::1","PGSQL","115","<T/C/Z"
"55","50.515523","::1","::1","TCP","64","49674  >  5432 [ACK] Seq=2146 Ack=562 Win=8394 Len=0"
"56","52.718511","::1","::1","UDP","84","49667  >  49667 Len=32"
"57","52.918675","::1","::1","UDP","76","49667  >  49667 Len=24"
"58","52.926219","::1","::1","UDP","84","49667  >  49667 Len=32"
"59","52.970980","::1","::1","UDP","1012","49667  >  49667 Len=960"
"60","52.971046","::1","::1","UDP","452","49667  >  49667 Len=400"
"61","52.971094","::1","::1","UDP","564","49667  >  49667 Len=512"
"62","55.547492","::1","::1","PGSQL","259",">Q"
"63","55.547678","::1","::1","TCP","64","5432  >  49674 [ACK] Seq=562 Ack=2341 Win=8241 Len=0"
"64","55.548740","::1","::1","UDP","340","49667  >  49667 Len=288"
"65","55.549076","::1","::1","PGSQL","115","<T/C/Z"
"66","55.549205","::1","::1","TCP","64","49674  >  5432 [ACK] Seq=2341 Ack=613 Win=8393 Len=0"
"67","60.618601","::1","::1","PGSQL","259",">Q"
"68","60.618778","::1","::1","TCP","64","5432  >  49674 [ACK] Seq=613 Ack=2536 Win=8240 Len=0"
"69","60.619822","::1","::1","UDP","340","49667  >  49667 Len=288"
"70","60.620046","::1","::1","PGSQL","115","<T/C/Z"
"71","60.620205","::1","::1","TCP","64","49674  >  5432 [ACK] Seq=2536 Ack=664 Win=8393 Len=0"
"72","65.688584","::1","::1","PGSQL","259",">Q"
"73","65.688737","::1","::1","TCP","64","5432  >  49674 [ACK] Seq=664 Ack=2731 Win=8240 Len=0"
"74","65.689603","::1","::1","UDP","340","49667  >  49667 Len=288"
"75","65.689817","::1","::1","PGSQL","115","<T/C/Z"
"76","65.689943","::1","::1","TCP","64","49674  >  5432 [ACK] Seq=2731 Ack=715 Win=8393 Len=0"
"77","70.744513","::1","::1","PGSQL","259",">Q"
"78","70.744664","::1","::1","TCP","64","5432  >  49674 [ACK] Seq=715 Ack=2926 Win=8239 Len=0"
"79","70.745654","::1","::1","UDP","340","49667  >  49667 Len=288"
"80","70.745848","::1","::1","PGSQL","115","<T/C/Z"
"81","70.745976","::1","::1","TCP","64","49674  >  5432 [ACK] Seq=2926 Ack=766 Win=8393 Len=0"
"82","75.791838","::1","::1","PGSQL","259",">Q"
"83","75.791954","::1","::1","TCP","64","5432  >  49674 [ACK] Seq=766 Ack=3121 Win=8238 Len=0"
"84","75.792812","::1","::1","UDP","340","49667  >  49667 Len=288"
"85","75.793017","::1","::1","PGSQL","115","<T/C/Z"
"86","75.793139","::1","::1","TCP","64","49674  >  5432 [ACK] Seq=3121 Ack=817 Win=8393 Len=0"
"87","80.846214","::1","::1","PGSQL","259",">Q"
"88","80.846424","::1","::1","TCP","64","5432  >  49674 [ACK] Seq=817 Ack=3316 Win=8237 Len=0"
"89","80.847649","::1","::1","UDP","340","49667  >  49667 Len=288"
"90","80.847879","::1","::1","PGSQL","115","<T/C/Z"
"91","80.848032","::1","::1","TCP","64","49674  >  5432 [ACK] Seq=3316 Ack=868 Win=8392 Len=0"
"92","85.897107","::1","::1","PGSQL","259",">Q"
"93","85.897157","::1","::1","TCP","64","5432  >  49674 [ACK] Seq=868 Ack=3511 Win=8237 Len=0"
"94","85.897581","::1","::1","UDP","340","49667  >  49667 Len=288"
"95","85.897694","::1","::1","PGSQL","115","<T/C/Z"
"96","85.897762","::1","::1","TCP","64","49674  >  5432 [ACK] Seq=3511 Ack=919 Win=8392 Len=0"
"97","90.960233","::1","::1","PGSQL","259",">Q"
"98","90.960303","::1","::1","TCP","64","5432  >  49674 [ACK] Seq=919 Ack=3706 Win=8236 Len=0"
"99","90.960758","::1","::1","UDP","340","49667  >  49667 Len=288"
"100","90.960840","::1","::1","PGSQL","115","<T/C/Z"
"101","90.960873","::1","::1","TCP","64","49674  >  5432 [ACK] Seq=3706 Ack=970 Win=8392 Len=0"
"102","96.019757","::1","::1","PGSQL","259",">Q"
"103","96.019904","::1","::1","TCP","64","5432  >  49674 [ACK] Seq=970 Ack=3901 Win=8235 Len=0"
"104","96.020950","::1","::1","UDP","340","49667  >  49667 Len=288"
"105","96.021149","::1","::1","PGSQL","115","<T/C/Z"
"106","96.021302","::1","::1","TCP","64","49674  >  5432 [ACK] Seq=3901 Ack=1021 Win=8392 Len=0"
"107","101.062021","::1","::1","PGSQL","259",">Q"
"108","101.062176","::1","::1","TCP","64","5432  >  49674 [ACK] Seq=1021 Ack=4096 Win=8234 Len=0"
"109","101.063324","::1","::1","UDP","340","49667  >  49667 Len=288"
"110","101.063581","::1","::1","PGSQL","115","<T/C/Z"
"111","101.063767","::1","::1","TCP","64","49674  >  5432 [ACK] Seq=4096 Ack=1072 Win=8392 Len=0"
"112","106.127833","::1","::1","PGSQL","259",">Q"
"113","106.128033","::1","::1","TCP","64","5432  >  49674 [ACK] Seq=1072 Ack=4291 Win=8234 Len=0"
"114","106.129330","::1","::1","UDP","340","49667  >  49667 Len=288"
"115","106.129555","::1","::1","PGSQL","115","<T/C/Z"
"116","106.129713","::1","::1","TCP","64","49674  >  5432 [ACK] Seq=4291 Ack=1123 Win=8391 Len=0"
"117","111.161717","::1","::1","PGSQL","259",">Q"
"118","111.161940","::1","::1","TCP","64","5432  >  49674 [ACK] Seq=1123 Ack=4486 Win=8233 Len=0"
"119","111.163320","::1","::1","UDP","340","49667  >  49667 Len=288"
"120","111.163546","::1","::1","PGSQL","115","<T/C/Z"
"121","111.163679","::1","::1","TCP","64","49674  >  5432 [ACK] Seq=4486 Ack=1174 Win=8391 Len=0"
"122","112.723082","::1","::1","UDP","84","49667  >  49667 Len=32"
"123","112.893538","::1","::1","UDP","76","49667  >  49667 Len=24"
"124","112.901709","::1","::1","UDP","84","49667  >  49667 Len=32"
"125","112.943760","::1","::1","UDP","1012","49667  >  49667 Len=960"
"126","112.943825","::1","::1","UDP","452","49667  >  49667 Len=400"
"127","112.943879","::1","::1","UDP","564","49667  >  49667 Len=512"
"128","116.214893","::1","::1","PGSQL","259",">Q"
"129","116.215041","::1","::1","TCP","64","5432  >  49674 [ACK] Seq=1174 Ack=4681 Win=8232 Len=0"
"130","116.216109","::1","::1","UDP","340","49667  >  49667 Len=288"
"131","116.216339","::1","::1","PGSQL","115","<T/C/Z"
"132","116.216457","::1","::1","TCP","64","49674  >  5432 [ACK] Seq=4681 Ack=1225 Win=8391 Len=0"
"133","121.279634","::1","::1","PGSQL","259",">Q"
"134","121.279828","::1","::1","TCP","64","5432  >  49674 [ACK] Seq=1225 Ack=4876 Win=8231 Len=0"
"135","121.280739","::1","::1","UDP","340","49667  >  49667 Len=288"
"136","121.280946","::1","::1","PGSQL","115","<T/C/Z"
"137","121.281041","::1","::1","TCP","64","49674  >  5432 [ACK] Seq=4876 Ack=1276 Win=8391 Len=0"
"138","126.306247","::1","::1","PGSQL","259",">Q"
"139","126.306420","::1","::1","TCP","64","5432  >  49674 [ACK] Seq=1276 Ack=5071 Win=8230 Len=0"
"140","126.307281","::1","::1","UDP","340","49667  >  49667 Len=288"
"141","126.307527","::1","::1","PGSQL","115","<T/C/Z"
"142","126.307672","::1","::1","TCP","64","49674  >  5432 [ACK] Seq=5071 Ack=1327 Win=8391 Len=0"
"143","131.361323","::1","::1","PGSQL","259",">Q"
"144","131.361368","::1","::1","TCP","64","5432  >  49674 [ACK] Seq=1327 Ack=5266 Win=8230 Len=0"
"145","131.361749","::1","::1","UDP","340","49667  >  49667 Len=288"
"146","131.361818","::1","::1","PGSQL","115","<T/C/Z"
"147","131.361859","::1","::1","TCP","64","49674  >  5432 [ACK] Seq=5266 Ack=1378 Win=8390 Len=0"
"148","136.389882","::1","::1","PGSQL","259",">Q"
"149","136.390023","::1","::1","TCP","64","5432  >  49674 [ACK] Seq=1378 Ack=5461 Win=8229 Len=0"
"150","136.390963","::1","::1","UDP","340","49667  >  49667 Len=288"
"151","136.391163","::1","::1","PGSQL","115","<T/C/Z"
"152","136.391310","::1","::1","TCP","64","49674  >  5432 [ACK] Seq=5461 Ack=1429 Win=8390 Len=0"
"153","141.421825","::1","::1","PGSQL","259",">Q"
"154","141.422065","::1","::1","TCP","64","5432  >  49674 [ACK] Seq=1429 Ack=5656 Win=8228 Len=0"
"155","141.423467","::1","::1","UDP","340","49667  >  49667 Len=288"
"156","141.423720","::1","::1","PGSQL","115","<T/C/Z"
"157","141.423849","::1","::1","TCP","64","49674  >  5432 [ACK] Seq=5656 Ack=1480 Win=8390 Len=0"
"158","146.479309","::1","::1","PGSQL","259",">Q"
"159","146.479502","::1","::1","TCP","64","5432  >  49674 [ACK] Seq=1480 Ack=5851 Win=8227 Len=0"
"160","146.480571","::1","::1","UDP","340","49667  >  49667 Len=288"
"161","146.480791","::1","::1","PGSQL","115","<T/C/Z"
"162","146.480910","::1","::1","TCP","64","49674  >  5432 [ACK] Seq=5851 Ack=1531 Win=8390 Len=0"
"163","151.523314","::1","::1","PGSQL","259",">Q"
"164","151.523455","::1","::1","TCP","64","5432  >  49674 [ACK] Seq=1531 Ack=6046 Win=8227 Len=0"
"165","151.524317","::1","::1","UDP","340","49667  >  49667 Len=288"
"166","151.524538","::1","::1","PGSQL","115","<T/C/Z"
"167","151.524654","::1","::1","TCP","64","49674  >  5432 [ACK] Seq=6046 Ack=1582 Win=8390 Len=0"
"168","156.579548","::1","::1","PGSQL","259",">Q"
"169","156.579752","::1","::1","TCP","64","5432  >  49674 [ACK] Seq=1582 Ack=6241 Win=8226 Len=0"
"170","156.580729","::1","::1","UDP","340","49667  >  49667 Len=288"
"171","156.580983","::1","::1","PGSQL","115","<T/C/Z"
"172","156.581133","::1","::1","TCP","64","49674  >  5432 [ACK] Seq=6241 Ack=1633 Win=8389 Len=0"
"173","161.636511","::1","::1","PGSQL","259",">Q"
"174","161.636749","::1","::1","TCP","64","5432  >  49674 [ACK] Seq=1633 Ack=6436 Win=8225 Len=0"
"175","161.637845","::1","::1","UDP","340","49667  >  49667 Len=288"
"176","161.638086","::1","::1","PGSQL","115","<T/C/Z"
"177","161.638211","::1","::1","TCP","64","49674  >  5432 [ACK] Seq=6436 Ack=1684 Win=8389 Len=0"
"178","166.659683","::1","::1","PGSQL","259",">Q"
"179","166.659824","::1","::1","TCP","64","5432  >  49674 [ACK] Seq=1684 Ack=6631 Win=8224 Len=0"
"180","166.660740","::1","::1","UDP","340","49667  >  49667 Len=288"
"181","166.660936","::1","::1","PGSQL","115","<T/C/Z"
"182","166.661080","::1","::1","TCP","64","49674  >  5432 [ACK] Seq=6631 Ack=1735 Win=8389 Len=0"
"183","171.711441","::1","::1","PGSQL","259",">Q"
"184","171.711658","::1","::1","TCP","64","5432  >  49674 [ACK] Seq=1735 Ack=6826 Win=8224 Len=0"
"185","171.712755","::1","::1","UDP","340","49667  >  49667 Len=288"
"186","171.712988","::1","::1","PGSQL","115","<T/C/Z"
"187","171.713113","::1","::1","TCP","64","49674  >  5432 [ACK] Seq=6826 Ack=1786 Win=8389 Len=0"
"188","172.723919","::1","::1","UDP","84","49667  >  49667 Len=32"
"189","172.875330","::1","::1","UDP","76","49667  >  49667 Len=24"
"190","172.882691","::1","::1","UDP","84","49667  >  49667 Len=32"
"191","172.922384","::1","::1","UDP","1012","49667  >  49667 Len=960"
"192","172.922453","::1","::1","UDP","452","49667  >  49667 Len=400"
"193","172.922512","::1","::1","UDP","564","49667  >  49667 Len=512"
"194","176.764882","::1","::1","PGSQL","259",">Q"
"195","176.765031","::1","::1","TCP","64","5432  >  49674 [ACK] Seq=1786 Ack=7021 Win=8223 Len=0"
"196","176.766117","::1","::1","UDP","340","49667  >  49667 Len=288"
"197","176.766357","::1","::1","PGSQL","115","<T/C/Z"
"198","176.766500","::1","::1","TCP","64","49674  >  5432 [ACK] Seq=7021 Ack=1837 Win=8389 Len=0"
"199","181.797441","::1","::1","PGSQL","259",">Q"
"200","181.797608","::1","::1","TCP","64","5432  >  49674 [ACK] Seq=1837 Ack=7216 Win=8222 Len=0"
"201","181.798489","::1","::1","UDP","340","49667  >  49667 Len=288"
"202","181.798662","::1","::1","PGSQL","115","<T/C/Z"
"203","181.798761","::1","::1","TCP","64","49674  >  5432 [ACK] Seq=7216 Ack=1888 Win=8388 Len=0"
"204","186.854687","::1","::1","PGSQL","259",">Q"
"205","186.854841","::1","::1","TCP","64","5432  >  49674 [ACK] Seq=1888 Ack=7411 Win=8221 Len=0"
"206","186.855857","::1","::1","UDP","340","49667  >  49667 Len=288"
"207","186.856099","::1","::1","PGSQL","115","<T/C/Z"
"208","186.856263","::1","::1","TCP","64","49674  >  5432 [ACK] Seq=7411 Ack=1939 Win=8388 Len=0"
"209","191.908948","::1","::1","PGSQL","259",">Q"
"210","191.909136","::1","::1","TCP","64","5432  >  49674 [ACK] Seq=1939 Ack=7606 Win=8221 Len=0"
"211","191.910239","::1","::1","UDP","340","49667  >  49667 Len=288"
"212","191.910471","::1","::1","PGSQL","115","<T/C/Z"
"213","191.910587","::1","::1","TCP","64","49674  >  5432 [ACK] Seq=7606 Ack=1990 Win=8388 Len=0"
"214","196.945630","::1","::1","PGSQL","259",">Q"
"215","196.945821","::1","::1","TCP","64","5432  >  49674 [ACK] Seq=1990 Ack=7801 Win=8220 Len=0"
"216","196.946813","::1","::1","UDP","340","49667  >  49667 Len=288"
"217","196.947019","::1","::1","PGSQL","115","<T/C/Z"
"218","196.947191","::1","::1","TCP","64","49674  >  5432 [ACK] Seq=7801 Ack=2041 Win=8388 Len=0"
"219","201.989507","::1","::1","PGSQL","259",">Q"
"220","201.989656","::1","::1","TCP","64","5432  >  49674 [ACK] Seq=2041 Ack=7996 Win=8219 Len=0"
"221","201.990592","::1","::1","UDP","340","49667  >  49667 Len=288"
"222","201.990778","::1","::1","PGSQL","115","<T/C/Z"
"223","201.990872","::1","::1","TCP","64","49674  >  5432 [ACK] Seq=7996 Ack=2092 Win=8388 Len=0"
"224","207.045067","::1","::1","PGSQL","259",">Q"
"225","207.045226","::1","::1","TCP","64","5432  >  49674 [ACK] Seq=2092 Ack=8191 Win=8218 Len=0"
"226","207.046332","::1","::1","UDP","340","49667  >  49667 Len=288"
"227","207.046559","::1","::1","PGSQL","115","<T/C/Z"
"228","207.046718","::1","::1","TCP","64","49674  >  5432 [ACK] Seq=8191 Ack=2143 Win=8387 Len=0"
"229","212.078186","::1","::1","PGSQL","259",">Q"
"230","212.078421","::1","::1","TCP","64","5432  >  49674 [ACK] Seq=2143 Ack=8386 Win=8218 Len=0"
"231","212.079741","::1","::1","UDP","340","49667  >  49667 Len=288"
"232","212.080021","::1","::1","PGSQL","115","<T/C/Z"
"233","212.080161","::1","::1","TCP","64","49674  >  5432 [ACK] Seq=8386 Ack=2194 Win=8387 Len=0"
"234","217.102368","::1","::1","PGSQL","259",">Q"
"235","217.102554","::1","::1","TCP","64","5432  >  49674 [ACK] Seq=2194 Ack=8581 Win=8217 Len=0"
"236","217.103714","::1","::1","UDP","340","49667  >  49667 Len=288"
"237","217.103959","::1","::1","PGSQL","115","<T/C/Z"
"238","217.104131","::1","::1","TCP","64","49674  >  5432 [ACK] Seq=8581 Ack=2245 Win=8387 Len=0"
"239","222.149454","::1","::1","PGSQL","259",">Q"
"240","222.149624","::1","::1","TCP","64","5432  >  49674 [ACK] Seq=2245 Ack=8776 Win=8216 Len=0"
"241","222.150566","::1","::1","UDP","340","49667  >  49667 Len=288"
"242","222.150798","::1","::1","PGSQL","115","<T/C/Z"
"243","222.150897","::1","::1","TCP","64","49674  >  5432 [ACK] Seq=8776 Ack=2296 Win=8387 Len=0"
"244","227.181982","::1","::1","PGSQL","259",">Q"
"245","227.182166","::1","::1","TCP","64","5432  >  49674 [ACK] Seq=2296 Ack=8971 Win=8215 Len=0"
"246","227.183258","::1","::1","UDP","340","49667  >  49667 Len=288"
"247","227.183497","::1","::1","PGSQL","115","<T/C/Z"
"248","227.183602","::1","::1","TCP","64","49674  >  5432 [ACK] Seq=8971 Ack=2347 Win=8387 Len=0"
"249","232.239542","::1","::1","PGSQL","259",">Q"
"250","232.239687","::1","::1","TCP","64","5432  >  49674 [ACK] Seq=2347 Ack=9166 Win=8214 Len=0"
"251","232.240719","::1","::1","UDP","340","49667  >  49667 Len=288"
"252","232.240911","::1","::1","PGSQL","115","<T/C/Z"
"253","232.241011","::1","::1","TCP","64","49674  >  5432 [ACK] Seq=9166 Ack=2398 Win=8386 Len=0"
"254","232.725766","::1","::1","UDP","84","49667  >  49667 Len=32"
"255","232.864269","::1","::1","UDP","76","49667  >  49667 Len=24"
"256","232.871555","::1","::1","UDP","84","49667  >  49667 Len=32"
"257","232.906435","::1","::1","UDP","1012","49667  >  49667 Len=960"
"258","232.906491","::1","::1","UDP","452","49667  >  49667 Len=400"
"259","232.906548","::1","::1","UDP","564","49667  >  49667 Len=512"
"260","237.281766","::1","::1","PGSQL","259",">Q"
"261","237.281893","::1","::1","TCP","64","5432  >  49674 [ACK] Seq=2398 Ack=9361 Win=8214 Len=0"
"262","237.282831","::1","::1","UDP","340","49667  >  49667 Len=288"
"263","237.283027","::1","::1","PGSQL","115","<T/C/Z"
"264","237.283133","::1","::1","TCP","64","49674  >  5432 [ACK] Seq=9361 Ack=2449 Win=8386 Len=0"
"265","242.333420","::1","::1","PGSQL","259",">Q"
"266","242.333557","::1","::1","TCP","64","5432  >  49674 [ACK] Seq=2449 Ack=9556 Win=8213 Len=0"
"267","242.334539","::1","::1","UDP","340","49667  >  49667 Len=288"
"268","242.334738","::1","::1","PGSQL","115","<T/C/Z"
"269","242.334879","::1","::1","TCP","64","49674  >  5432 [ACK] Seq=9556 Ack=2500 Win=8386 Len=0"
"270","247.378852","::1","::1","PGSQL","259",">Q"
"271","247.379014","::1","::1","TCP","64","5432  >  49674 [ACK] Seq=2500 Ack=9751 Win=8212 Len=0"
"272","247.380137","::1","::1","UDP","340","49667  >  49667 Len=288"
"273","247.380354","::1","::1","PGSQL","115","<T/C/Z"
"274","247.380470","::1","::1","TCP","64","49674  >  5432 [ACK] Seq=9751 Ack=2551 Win=8386 Len=0"
"275","252.437697","::1","::1","PGSQL","259",">Q"
"276","252.437736","::1","::1","TCP","64","5432  >  49674 [ACK] Seq=2551 Ack=9946 Win=8211 Len=0"
"277","252.438075","::1","::1","UDP","340","49667  >  49667 Len=288"
"278","252.438138","::1","::1","PGSQL","115","<T/C/Z"
"279","252.438180","::1","::1","TCP","64","49674  >  5432 [ACK] Seq=9946 Ack=2602 Win=8386 Len=0"
"280","257.494794","::1","::1","PGSQL","259",">Q"
"281","257.494877","::1","::1","TCP","64","5432  >  49674 [ACK] Seq=2602 Ack=10141 Win=8211 Len=0"
"282","257.495426","::1","::1","UDP","340","49667  >  49667 Len=288"
"283","257.495529","::1","::1","PGSQL","115","<T/C/Z"
"284","257.495580","::1","::1","TCP","64","49674  >  5432 [ACK] Seq=10141 Ack=2653 Win=8385 Len=0"
"285","262.552859","::1","::1","PGSQL","259",">Q"
"286","262.553019","::1","::1","TCP","64","5432  >  49674 [ACK] Seq=2653 Ack=10336 Win=8210 Len=0"
"287","262.553885","::1","::1","UDP","340","49667  >  49667 Len=288"
"288","262.554124","::1","::1","PGSQL","115","<T/C/Z"
"289","262.554253","::1","::1","TCP","64","49674  >  5432 [ACK] Seq=10336 Ack=2704 Win=8385 Len=0"
"290","267.592616","::1","::1","PGSQL","259",">Q"
"291","267.592756","::1","::1","TCP","64","5432  >  49674 [ACK] Seq=2704 Ack=10531 Win=8209 Len=0"
"292","267.593694","::1","::1","UDP","340","49667  >  49667 Len=288"
"293","267.593881","::1","::1","PGSQL","115","<T/C/Z"
"294","267.593991","::1","::1","TCP","64","49674  >  5432 [ACK] Seq=10531 Ack=2755 Win=8385 Len=0"
"295","272.628442","::1","::1","PGSQL","259",">Q"
"296","272.628608","::1","::1","TCP","64","5432  >  49674 [ACK] Seq=2755 Ack=10726 Win=8208 Len=0"
"297","272.629559","::1","::1","UDP","340","49667  >  49667 Len=288"
"298","272.629725","::1","::1","PGSQL","115","<T/C/Z"
"299","272.629829","::1","::1","TCP","64","49674  >  5432 [ACK] Seq=10726 Ack=2806 Win=8385 Len=0"
"300","277.681557","::1","::1","PGSQL","259",">Q"
"301","277.681717","::1","::1","TCP","64","5432  >  49674 [ACK] Seq=2806 Ack=10921 Win=8208 Len=0"
"302","277.682681","::1","::1","UDP","340","49667  >  49667 Len=288"
"303","277.682868","::1","::1","PGSQL","115","<T/C/Z"
"304","277.682966","::1","::1","TCP","64","49674  >  5432 [ACK] Seq=10921 Ack=2857 Win=8385 Len=0"
"305","282.703843","::1","::1","PGSQL","259",">Q"
"306","282.704015","::1","::1","TCP","64","5432  >  49674 [ACK] Seq=2857 Ack=11116 Win=8207 Len=0"
"307","282.705104","::1","::1","UDP","340","49667  >  49667 Len=288"
"308","282.705319","::1","::1","PGSQL","115","<T/C/Z"
"309","282.705450","::1","::1","TCP","64","49674  >  5432 [ACK] Seq=11116 Ack=2908 Win=8384 Len=0"
"310","285.101940","0.0.0.0","255.255.255.255","DHCP","346","DHCP Request  - Transaction ID 0xb1beaa94"
"311","285.102297","0.0.0.0","255.255.255.255","DHCP","346","DHCP Request  - Transaction ID 0xb1beaa94"
"312","285.155017","10.11.156.243","20.198.118.190","TLSv1.2","143","Application Data"
"313","285.169819","10.11.156.243","224.0.0.22","IGMPv3","44","Membership Report / Leave group 224.0.0.252"
"314","285.186105","10.11.156.243","224.0.0.22","IGMPv3","60","Membership Report / Join group 239.255.255.250 for any sources / Join group 224.0.0.251 for any sources / Leave group 224.0.0.252"
"315","285.195979","10.11.156.243","224.0.0.22","IGMPv3","44","Membership Report / Join group 224.0.0.252 for any sources"
"316","285.321399","10.11.156.243","224.0.0.251","MDNS","67","Standard query 0x0000 ANY Neavil-2305.local, ""QM"" question"
"317","285.322334","fe80::2335:8d7c:c356:54e9","ff02::fb","MDNS","87","Standard query 0x0000 ANY Neavil-2305.local, ""QM"" question"
"318","285.322664","10.11.156.243","224.0.0.251","MDNS","105","Standard query response 0x0000 AAAA fe80::2335:8d7c:c356:54e9 A 10.11.156.243"
"319","285.323363","fe80::2335:8d7c:c356:54e9","ff02::fb","MDNS","125","Standard query response 0x0000 AAAA fe80::2335:8d7c:c356:54e9 A 10.11.156.243"
"320","285.323640","fe80::2335:8d7c:c356:54e9","ff02::1:3","LLMNR","81","Standard query 0xd497 ANY Neavil-2305"
"321","285.324031","10.11.156.243","224.0.0.252","LLMNR","61","Standard query 0xd497 ANY Neavil-2305"
"322","285.334068","10.11.156.243","224.0.0.251","MDNS","67","Standard query 0x0000 ANY Neavil-2305.local, ""QM"" question"
"323","285.334639","fe80::2335:8d7c:c356:54e9","ff02::fb","MDNS","87","Standard query 0x0000 ANY Neavil-2305.local, ""QM"" question"
"324","285.335184","10.11.156.243","224.0.0.251","MDNS","105","Standard query response 0x0000 AAAA fe80::2335:8d7c:c356:54e9 A 10.11.156.243"
"325","285.335582","fe80::2335:8d7c:c356:54e9","ff02::fb","MDNS","125","Standard query response 0x0000 AAAA fe80::2335:8d7c:c356:54e9 A 10.11.156.243"
"326","285.335980","fe80::2335:8d7c:c356:54e9","ff02::1:3","LLMNR","81","Standard query 0xdb32 ANY Neavil-2305"
"327","285.336568","10.11.156.243","224.0.0.252","LLMNR","61","Standard query 0xdb32 ANY Neavil-2305"
"328","287.755594","::1","::1","PGSQL","259",">Q"
"329","287.755665","::1","::1","TCP","64","5432  >  49674 [ACK] Seq=2908 Ack=11311 Win=8206 Len=0"
"330","287.756198","::1","::1","UDP","340","49667  >  49667 Len=288"
"331","287.756305","::1","::1","PGSQL","115","<T/C/Z"
"332","287.756362","::1","::1","TCP","64","49674  >  5432 [ACK] Seq=11311 Ack=2959 Win=8384 Len=0"
"333","290.296854","::1","::1","UDP","140","49667  >  49667 Len=88"
"334","292.734738","::1","::1","UDP","84","49667  >  49667 Len=32"
"335","292.811467","::1","::1","PGSQL","259",">Q"
"336","292.811613","::1","::1","TCP","64","5432  >  49674 [ACK] Seq=2959 Ack=11506 Win=8205 Len=0"
"337","292.812682","::1","::1","UDP","340","49667  >  49667 Len=288"
"338","292.812881","::1","::1","PGSQL","115","<T/C/Z"
"339","292.812991","::1","::1","TCP","64","49674  >  5432 [ACK] Seq=11506 Ack=3010 Win=8384 Len=0"
"340","292.928811","::1","::1","UDP","76","49667  >  49667 Len=24"
"341","292.936503","::1","::1","UDP","84","49667  >  49667 Len=32"
"342","292.975139","::1","::1","UDP","1012","49667  >  49667 Len=960"
"343","292.975208","::1","::1","UDP","452","49667  >  49667 Len=400"
"344","292.975266","::1","::1","UDP","564","49667  >  49667 Len=512"
"345","293.803583","10.11.156.243","224.0.0.251","MDNS","72","Standard query 0x0000 PTR _googlecast._tcp.local, ""QM"" question"
"346","293.804924","fe80::2335:8d7c:c356:54e9","ff02::fb","MDNS","92","Standard query 0x0000 PTR _googlecast._tcp.local, ""QM"" question"
"347","293.805734","10.11.156.243","224.0.0.251","MDNS","72","Standard query 0x0000 PTR _googlecast._tcp.local, ""QM"" question"
"348","293.806465","fe80::2335:8d7c:c356:54e9","ff02::fb","MDNS","92","Standard query 0x0000 PTR _googlecast._tcp.local, ""QM"" question"
"349","294.810642","10.11.156.243","224.0.0.251","MDNS","72","Standard query 0x0000 PTR _googlecast._tcp.local, ""QM"" question"
"350","294.811887","fe80::2335:8d7c:c356:54e9","ff02::fb","MDNS","92","Standard query 0x0000 PTR _googlecast._tcp.local, ""QM"" question"
"351","294.812676","10.11.156.243","224.0.0.251","MDNS","72","Standard query 0x0000 PTR _googlecast._tcp.local, ""QM"" question"
"352","294.813384","fe80::2335:8d7c:c356:54e9","ff02::fb","MDNS","92","Standard query 0x0000 PTR _googlecast._tcp.local, ""QM"" question"
"353","296.823568","10.11.156.243","224.0.0.251","MDNS","72","Standard query 0x0000 PTR _googlecast._tcp.local, ""QM"" question"
"354","296.825428","fe80::2335:8d7c:c356:54e9","ff02::fb","MDNS","92","Standard query 0x0000 PTR _googlecast._tcp.local, ""QM"" question"
"355","296.827188","10.11.156.243","224.0.0.251","MDNS","72","Standard query 0x0000 PTR _googlecast._tcp.local, ""QM"" question"
"356","296.828577","fe80::2335:8d7c:c356:54e9","ff02::fb","MDNS","92","Standard query 0x0000 PTR _googlecast._tcp.local, ""QM"" question"
"357","297.869586","::1","::1","PGSQL","259",">Q"
"358","297.869757","::1","::1","TCP","64","5432  >  49674 [ACK] Seq=3010 Ack=11701 Win=8205 Len=0"
"359","297.870876","::1","::1","UDP","340","49667  >  49667 Len=288"
"360","297.871142","::1","::1","PGSQL","115","<T/C/Z"
"361","297.871290","::1","::1","TCP","64","49674  >  5432 [ACK] Seq=11701 Ack=3061 Win=8384 Len=0"
"362","302.929942","::1","::1","PGSQL","259",">Q"
"363","302.930055","::1","::1","TCP","64","5432  >  49674 [ACK] Seq=3061 Ack=11896 Win=8204 Len=0"
"364","302.931115","::1","::1","UDP","340","49667  >  49667 Len=288"
"365","302.931371","::1","::1","PGSQL","115","<T/C/Z"
"366","302.931525","::1","::1","TCP","64","49674  >  5432 [ACK] Seq=11896 Ack=3112 Win=8384 Len=0"
"367","307.988521","::1","::1","PGSQL","259",">Q"
"368","307.988689","::1","::1","TCP","64","5432  >  49674 [ACK] Seq=3112 Ack=12091 Win=8203 Len=0"
"369","307.989789","::1","::1","UDP","340","49667  >  49667 Len=288"
"370","307.989998","::1","::1","PGSQL","115","<T/C/Z"
"371","307.990111","::1","::1","TCP","64","49674  >  5432 [ACK] Seq=12091 Ack=3163 Win=8383 Len=0"
"372","313.045089","::1","::1","PGSQL","259",">Q"
"373","313.045242","::1","::1","TCP","64","5432  >  49674 [ACK] Seq=3163 Ack=12286 Win=8202 Len=0"
"374","313.046510","::1","::1","UDP","340","49667  >  49667 Len=288"
"375","313.046882","::1","::1","PGSQL","115","<T/C/Z"
"376","313.047020","::1","::1","TCP","64","49674  >  5432 [ACK] Seq=12286 Ack=3214 Win=8383 Len=0"
"377","318.090393","::1","::1","PGSQL","259",">Q"
"378","318.090618","::1","::1","TCP","64","5432  >  49674 [ACK] Seq=3214 Ack=12481 Win=8202 Len=0"
"379","318.092093","::1","::1","UDP","340","49667  >  49667 Len=288"
"380","318.092375","::1","::1","PGSQL","115","<T/C/Z"
"381","318.092519","::1","::1","TCP","64","49674  >  5432 [ACK] Seq=12481 Ack=3265 Win=8383 Len=0"
"382","323.137728","::1","::1","PGSQL","259",">Q"
"383","323.137884","::1","::1","TCP","64","5432  >  49674 [ACK] Seq=3265 Ack=12676 Win=8201 Len=0"
"384","323.138950","::1","::1","UDP","340","49667  >  49667 Len=288"
"385","323.139208","::1","::1","PGSQL","115","<T/C/Z"
"386","323.139332","::1","::1","TCP","64","49674  >  5432 [ACK] Seq=12676 Ack=3316 Win=8383 Len=0"
"387","328.184754","::1","::1","PGSQL","259",">Q"
"388","328.184941","::1","::1","TCP","64","5432  >  49674 [ACK] Seq=3316 Ack=12871 Win=8200 Len=0"
"389","328.186115","::1","::1","UDP","340","49667  >  49667 Len=288"
"390","328.186318","::1","::1","PGSQL","115","<T/C/Z"
"391","328.186453","::1","::1","TCP","64","49674  >  5432 [ACK] Seq=12871 Ack=3367 Win=8383 Len=0"
"392","333.244501","::1","::1","PGSQL","259",">Q"
"393","333.244660","::1","::1","TCP","64","5432  >  49674 [ACK] Seq=3367 Ack=13066 Win=8199 Len=0"
"394","333.245750","::1","::1","UDP","340","49667  >  49667 Len=288"
"395","333.246022","::1","::1","PGSQL","115","<T/C/Z"
"396","333.246185","::1","::1","TCP","64","49674  >  5432 [ACK] Seq=13066 Ack=3418 Win=8382 Len=0"
"397","338.291150","::1","::1","PGSQL","259",">Q"
"398","338.291384","::1","::1","TCP","64","5432  >  49674 [ACK] Seq=3418 Ack=13261 Win=8198 Len=0"
"399","338.292546","::1","::1","UDP","340","49667  >  49667 Len=288"
"400","338.292810","::1","::1","PGSQL","115","<T/C/Z"
"401","338.293000","::1","::1","TCP","64","49674  >  5432 [ACK] Seq=13261 Ack=3469 Win=8382 Len=0"
"402","343.346542","::1","::1","PGSQL","259",">Q"
"403","343.346604","::1","::1","TCP","64","5432  >  49674 [ACK] Seq=3469 Ack=13456 Win=8198 Len=0"
"404","343.347039","::1","::1","UDP","340","49667  >  49667 Len=288"
"405","343.347144","::1","::1","PGSQL","115","<T/C/Z"
"406","343.347190","::1","::1","TCP","64","49674  >  5432 [ACK] Seq=13456 Ack=3520 Win=8382 Len=0"
"407","348.408186","::1","::1","PGSQL","259",">Q"
"408","348.408337","::1","::1","TCP","64","5432  >  49674 [ACK] Seq=3520 Ack=13651 Win=8197 Len=0"
"409","348.409409","::1","::1","UDP","340","49667  >  49667 Len=288"
"410","348.409681","::1","::1","PGSQL","115","<T/C/Z"
"411","348.409855","::1","::1","TCP","64","49674  >  5432 [ACK] Seq=13651 Ack=3571 Win=8382 Len=0"
"412","352.736697","::1","::1","UDP","84","49667  >  49667 Len=32"
"413","352.908976","::1","::1","UDP","76","49667  >  49667 Len=24"
"414","352.916482","::1","::1","UDP","84","49667  >  49667 Len=32"
"415","352.960634","::1","::1","UDP","1012","49667  >  49667 Len=960"
"416","352.960697","::1","::1","UDP","452","49667  >  49667 Len=400"
"417","352.960733","::1","::1","UDP","564","49667  >  49667 Len=512"
"418","353.451412","::1","::1","PGSQL","259",">Q"
"419","353.451586","::1","::1","TCP","64","5432  >  49674 [ACK] Seq=3571 Ack=13846 Win=8196 Len=0"
"420","353.452667","::1","::1","UDP","340","49667  >  49667 Len=288"
"421","353.452836","::1","::1","PGSQL","115","<T/C/Z"
"422","353.452949","::1","::1","TCP","64","49674  >  5432 [ACK] Seq=13846 Ack=3622 Win=8382 Len=0"
"423","358.476570","::1","::1","PGSQL","259",">Q"
"424","358.476760","::1","::1","TCP","64","5432  >  49674 [ACK] Seq=3622 Ack=14041 Win=8195 Len=0"
"425","358.477814","::1","::1","UDP","340","49667  >  49667 Len=288"
"426","358.478043","::1","::1","PGSQL","115","<T/C/Z"
"427","358.478170","::1","::1","TCP","64","49674  >  5432 [ACK] Seq=14041 Ack=3673 Win=8381 Len=0"
"428","363.545435","::1","::1","PGSQL","259",">Q"
"429","363.545586","::1","::1","TCP","64","5432  >  49674 [ACK] Seq=3673 Ack=14236 Win=8195 Len=0"
"430","363.546538","::1","::1","UDP","340","49667  >  49667 Len=288"
"431","363.546721","::1","::1","PGSQL","115","<T/C/Z"
"432","363.546824","::1","::1","TCP","64","49674  >  5432 [ACK] Seq=14236 Ack=3724 Win=8381 Len=0"
"433","368.581802","::1","::1","PGSQL","259",">Q"
"434","368.581934","::1","::1","TCP","64","5432  >  49674 [ACK] Seq=3724 Ack=14431 Win=8194 Len=0"
"435","368.582871","::1","::1","UDP","340","49667  >  49667 Len=288"
"436","368.583095","::1","::1","PGSQL","115","<T/C/Z"
"437","368.583229","::1","::1","TCP","64","49674  >  5432 [ACK] Seq=14431 Ack=3775 Win=8381 Len=0"
"438","373.622397","::1","::1","PGSQL","259",">Q"
"439","373.622577","::1","::1","TCP","64","5432  >  49674 [ACK] Seq=3775 Ack=14626 Win=8193 Len=0"
"440","373.623588","::1","::1","UDP","340","49667  >  49667 Len=288"
"441","373.623754","::1","::1","PGSQL","115","<T/C/Z"
"442","373.623846","::1","::1","TCP","64","49674  >  5432 [ACK] Seq=14626 Ack=3826 Win=8381 Len=0"
"443","378.670300","::1","::1","PGSQL","259",">Q"
"444","378.670515","::1","::1","TCP","64","5432  >  49674 [ACK] Seq=3826 Ack=14821 Win=8192 Len=0"
"445","378.671809","::1","::1","UDP","340","49667  >  49667 Len=288"
"446","378.672044","::1","::1","PGSQL","115","<T/C/Z"
"447","378.672168","::1","::1","TCP","64","49674  >  5432 [ACK] Seq=14821 Ack=3877 Win=8381 Len=0"
"448","383.714569","::1","::1","PGSQL","259",">Q"
"449","383.714713","::1","::1","TCP","64","5432  >  49674 [ACK] Seq=3877 Ack=15016 Win=8192 Len=0"
"450","383.715939","::1","::1","UDP","340","49667  >  49667 Len=288"
"451","383.716183","::1","::1","PGSQL","115","<T/C/Z"
"452","383.716310","::1","::1","TCP","64","49674  >  5432 [ACK] Seq=15016 Ack=3928 Win=8380 Len=0"
"453","388.771495","::1","::1","PGSQL","259",">Q"
"454","388.771644","::1","::1","TCP","64","5432  >  49674 [ACK] Seq=3928 Ack=15211 Win=8191 Len=0"
"455","388.772685","::1","::1","UDP","340","49667  >  49667 Len=288"
"456","388.772914","::1","::1","PGSQL","115","<T/C/Z"
"457","388.773047","::1","::1","TCP","64","49674  >  5432 [ACK] Seq=15211 Ack=3979 Win=8380 Len=0"
"458","393.812381","::1","::1","PGSQL","259",">Q"
"459","393.812555","::1","::1","TCP","64","5432  >  49674 [ACK] Seq=3979 Ack=15406 Win=8190 Len=0"
"460","393.813505","::1","::1","UDP","340","49667  >  49667 Len=288"
"461","393.813736","::1","::1","PGSQL","115","<T/C/Z"
"462","393.813894","::1","::1","TCP","64","49674  >  5432 [ACK] Seq=15406 Ack=4030 Win=8380 Len=0"
"463","398.862558","::1","::1","PGSQL","259",">Q"
"464","398.862699","::1","::1","TCP","64","5432  >  49674 [ACK] Seq=4030 Ack=15601 Win=8189 Len=0"
"465","398.863800","::1","::1","UDP","340","49667  >  49667 Len=288"
"466","398.863993","::1","::1","PGSQL","115","<T/C/Z"
"467","398.864087","::1","::1","TCP","64","49674  >  5432 [ACK] Seq=15601 Ack=4081 Win=8380 Len=0"
"468","403.929934","::1","::1","PGSQL","259",">Q"
"469","403.930059","::1","::1","TCP","64","5432  >  49674 [ACK] Seq=4081 Ack=15796 Win=8189 Len=0"
"470","403.930966","::1","::1","UDP","340","49667  >  49667 Len=288"
"471","403.931163","::1","::1","PGSQL","115","<T/C/Z"
"472","403.931258","::1","::1","TCP","64","49674  >  5432 [ACK] Seq=15796 Ack=4132 Win=8380 Len=0"
"473","408.969475","::1","::1","PGSQL","259",">Q"
"474","408.969625","::1","::1","TCP","64","5432  >  49674 [ACK] Seq=4132 Ack=15991 Win=8188 Len=0"
"475","408.970726","::1","::1","UDP","340","49667  >  49667 Len=288"
"476","408.970941","::1","::1","PGSQL","115","<T/C/Z"
"477","408.971071","::1","::1","TCP","64","49674  >  5432 [ACK] Seq=15991 Ack=4183 Win=8379 Len=0"
"478","412.749013","::1","::1","UDP","84","49667  >  49667 Len=32"
"479","412.955204","::1","::1","UDP","76","49667  >  49667 Len=24"
"480","412.962751","::1","::1","UDP","84","49667  >  49667 Len=32"
"481","413.003868","::1","::1","UDP","1012","49667  >  49667 Len=960"
"482","413.003931","::1","::1","UDP","452","49667  >  49667 Len=400"
"483","413.003981","::1","::1","UDP","564","49667  >  49667 Len=512"
"484","414.027186","::1","::1","PGSQL","259",">Q"
"485","414.027372","::1","::1","TCP","64","5432  >  49674 [ACK] Seq=4183 Ack=16186 Win=8187 Len=0"
"486","414.028445","::1","::1","UDP","340","49667  >  49667 Len=288"
"487","414.028668","::1","::1","PGSQL","115","<T/C/Z"
"488","414.028776","::1","::1","TCP","64","49674  >  5432 [ACK] Seq=16186 Ack=4234 Win=8379 Len=0"
"489","419.074937","::1","::1","PGSQL","259",">Q"
"490","419.075098","::1","::1","TCP","64","5432  >  49674 [ACK] Seq=4234 Ack=16381 Win=8186 Len=0"
"491","419.076111","::1","::1","UDP","340","49667  >  49667 Len=288"
"492","419.076355","::1","::1","PGSQL","115","<T/C/Z"
"493","419.076474","::1","::1","TCP","64","49674  >  5432 [ACK] Seq=16381 Ack=4285 Win=8379 Len=0"
"494","424.096386","::1","::1","PGSQL","259",">Q"
"495","424.096546","::1","::1","TCP","64","5432  >  49674 [ACK] Seq=4285 Ack=16576 Win=8186 Len=0"
"496","424.097633","::1","::1","UDP","340","49667  >  49667 Len=288"
"497","424.097851","::1","::1","PGSQL","115","<T/C/Z"
"498","424.097948","::1","::1","TCP","64","49674  >  5432 [ACK] Seq=16576 Ack=4336 Win=8379 Len=0"
"499","429.142914","::1","::1","PGSQL","259",">Q"
"500","429.143098","::1","::1","TCP","64","5432  >  49674 [ACK] Seq=4336 Ack=16771 Win=8185 Len=0"
"501","429.144147","::1","::1","UDP","340","49667  >  49667 Len=288"
"502","429.144391","::1","::1","PGSQL","115","<T/C/Z"
"503","429.144574","::1","::1","TCP","64","49674  >  5432 [ACK] Seq=16771 Ack=4387 Win=8379 Len=0"
"504","434.177273","::1","::1","PGSQL","259",">Q"
"505","434.177499","::1","::1","TCP","64","5432  >  49674 [ACK] Seq=4387 Ack=16966 Win=8184 Len=0"
"506","434.178361","::1","::1","UDP","340","49667  >  49667 Len=288"
"507","434.178616","::1","::1","PGSQL","115","<T/C/Z"
"508","434.178746","::1","::1","TCP","64","49674  >  5432 [ACK] Seq=16966 Ack=4438 Win=8378 Len=0"
"509","439.206775","::1","::1","PGSQL","259",">Q"
"510","439.207052","::1","::1","TCP","64","5432  >  49674 [ACK] Seq=4438 Ack=17161 Win=8440 Len=0"
"511","439.208132","::1","::1","UDP","340","49667  >  49667 Len=288"
"512","439.208389","::1","::1","PGSQL","115","<T/C/Z"
"513","439.208536","::1","::1","TCP","64","49674  >  5432 [ACK] Seq=17161 Ack=4489 Win=8378 Len=0"
"514","444.266708","::1","::1","PGSQL","259",">Q"
"515","444.267058","::1","::1","TCP","64","5432  >  49674 [ACK] Seq=4489 Ack=17356 Win=8439 Len=0"
"516","444.268015","::1","::1","UDP","340","49667  >  49667 Len=288"
"517","444.268245","::1","::1","PGSQL","115","<T/C/Z"
"518","444.268360","::1","::1","TCP","64","49674  >  5432 [ACK] Seq=17356 Ack=4540 Win=8378 Len=0"
"519","449.320552","::1","::1","PGSQL","259",">Q"
"520","449.320711","::1","::1","TCP","64","5432  >  49674 [ACK] Seq=4540 Ack=17551 Win=8438 Len=0"
"521","449.321780","::1","::1","UDP","340","49667  >  49667 Len=288"
"522","449.322039","::1","::1","PGSQL","115","<T/C/Z"
"523","449.322215","::1","::1","TCP","64","49674  >  5432 [ACK] Seq=17551 Ack=4591 Win=8378 Len=0"
"524","454.353728","::1","::1","PGSQL","259",">Q"
"525","454.353934","::1","::1","TCP","64","5432  >  49674 [ACK] Seq=4591 Ack=17746 Win=8437 Len=0"
"526","454.355021","::1","::1","UDP","340","49667  >  49667 Len=288"
"527","454.355245","::1","::1","PGSQL","115","<T/C/Z"
"528","454.355363","::1","::1","TCP","64","49674  >  5432 [ACK] Seq=17746 Ack=4642 Win=8378 Len=0"
"529","459.395331","::1","::1","PGSQL","259",">Q"
"530","459.395471","::1","::1","TCP","64","5432  >  49674 [ACK] Seq=4642 Ack=17941 Win=8437 Len=0"
"531","459.396502","::1","::1","UDP","340","49667  >  49667 Len=288"
"532","459.396753","::1","::1","PGSQL","115","<T/C/Z"
"533","459.396919","::1","::1","TCP","64","49674  >  5432 [ACK] Seq=17941 Ack=4693 Win=8377 Len=0"
"534","464.428141","::1","::1","PGSQL","259",">Q"
"535","464.428330","::1","::1","TCP","64","5432  >  49674 [ACK] Seq=4693 Ack=18136 Win=8436 Len=0"
"536","464.429421","::1","::1","UDP","340","49667  >  49667 Len=288"
"537","464.429681","::1","::1","PGSQL","115","<T/C/Z"
"538","464.429809","::1","::1","TCP","64","49674  >  5432 [ACK] Seq=18136 Ack=4744 Win=8377 Len=0"
"539","469.485492","::1","::1","PGSQL","259",">Q"
"540","469.485670","::1","::1","TCP","64","5432  >  49674 [ACK] Seq=4744 Ack=18331 Win=8435 Len=0"
"541","469.486825","::1","::1","UDP","340","49667  >  49667 Len=288"
"542","469.487042","::1","::1","PGSQL","115","<T/C/Z"
"543","469.487165","::1","::1","TCP","64","49674  >  5432 [ACK] Seq=18331 Ack=4795 Win=8377 Len=0"
"544","472.762763","::1","::1","UDP","84","49667  >  49667 Len=32"
"545","472.947183","::1","::1","UDP","76","49667  >  49667 Len=24"
"546","472.954046","::1","::1","UDP","84","49667  >  49667 Len=32"
"547","473.005410","::1","::1","UDP","1012","49667  >  49667 Len=960"
"548","473.005475","::1","::1","UDP","452","49667  >  49667 Len=400"
"549","473.005538","::1","::1","UDP","564","49667  >  49667 Len=512"
"550","474.523407","::1","::1","PGSQL","259",">Q"
"551","474.523539","::1","::1","TCP","64","5432  >  49674 [ACK] Seq=4795 Ack=18526 Win=8434 Len=0"
"552","474.524500","::1","::1","UDP","340","49667  >  49667 Len=288"
"553","474.524697","::1","::1","PGSQL","115","<T/C/Z"
"554","474.524805","::1","::1","TCP","64","49674  >  5432 [ACK] Seq=18526 Ack=4846 Win=8377 Len=0"
"555","479.557877","::1","::1","PGSQL","259",">Q"
"556","479.558091","::1","::1","TCP","64","5432  >  49674 [ACK] Seq=4846 Ack=18721 Win=8434 Len=0"
"557","479.559021","::1","::1","UDP","340","49667  >  49667 Len=288"
"558","479.559216","::1","::1","PGSQL","115","<T/C/Z"
"559","479.559355","::1","::1","TCP","64","49674  >  5432 [ACK] Seq=18721 Ack=4897 Win=8377 Len=0"
"560","484.628180","::1","::1","PGSQL","259",">Q"
"561","484.628379","::1","::1","TCP","64","5432  >  49674 [ACK] Seq=4897 Ack=18916 Win=8433 Len=0"
"562","484.629546","::1","::1","UDP","340","49667  >  49667 Len=288"
"563","484.629785","::1","::1","PGSQL","115","<T/C/Z"
"564","484.629940","::1","::1","TCP","64","49674  >  5432 [ACK] Seq=18916 Ack=4948 Win=8376 Len=0"
"565","489.700769","::1","::1","PGSQL","259",">Q"
"566","489.700918","::1","::1","TCP","64","5432  >  49674 [ACK] Seq=4948 Ack=19111 Win=8432 Len=0"
"567","489.702118","::1","::1","UDP","340","49667  >  49667 Len=288"
"568","489.702388","::1","::1","PGSQL","115","<T/C/Z"
"569","489.702542","::1","::1","TCP","64","49674  >  5432 [ACK] Seq=19111 Ack=4999 Win=8376 Len=0"
"570","494.732398","::1","::1","PGSQL","259",">Q"
"571","494.732604","::1","::1","TCP","64","5432  >  49674 [ACK] Seq=4999 Ack=19306 Win=8431 Len=0"
"572","494.733675","::1","::1","UDP","340","49667  >  49667 Len=288"
"573","494.733856","::1","::1","PGSQL","115","<T/C/Z"
"574","494.733957","::1","::1","TCP","64","49674  >  5432 [ACK] Seq=19306 Ack=5050 Win=8376 Len=0"
"575","499.772424","::1","::1","PGSQL","259",">Q"
"576","499.772622","::1","::1","TCP","64","5432  >  49674 [ACK] Seq=5050 Ack=19501 Win=8430 Len=0"
"577","499.773701","::1","::1","UDP","340","49667  >  49667 Len=288"
"578","499.773918","::1","::1","PGSQL","115","<T/C/Z"
"579","499.774042","::1","::1","TCP","64","49674  >  5432 [ACK] Seq=19501 Ack=5101 Win=8376 Len=0"
"580","504.808915","::1","::1","PGSQL","259",">Q"
"581","504.809141","::1","::1","TCP","64","5432  >  49674 [ACK] Seq=5101 Ack=19696 Win=8430 Len=0"
"582","504.810187","::1","::1","UDP","340","49667  >  49667 Len=288"
"583","504.810447","::1","::1","PGSQL","115","<T/C/Z"
"584","504.810624","::1","::1","TCP","64","49674  >  5432 [ACK] Seq=19696 Ack=5152 Win=8376 Len=0"
"585","509.846960","::1","::1","PGSQL","259",">Q"
"586","509.847125","::1","::1","TCP","64","5432  >  49674 [ACK] Seq=5152 Ack=19891 Win=8429 Len=0"
"587","509.848214","::1","::1","UDP","340","49667  >  49667 Len=288"
"588","509.848461","::1","::1","PGSQL","115","<T/C/Z"
"589","509.848641","::1","::1","TCP","64","49674  >  5432 [ACK] Seq=19891 Ack=5203 Win=8375 Len=0"
"590","514.896400","::1","::1","PGSQL","259",">Q"
"591","514.896579","::1","::1","TCP","64","5432  >  49674 [ACK] Seq=5203 Ack=20086 Win=8428 Len=0"
"592","514.897677","::1","::1","UDP","340","49667  >  49667 Len=288"
"593","514.897894","::1","::1","PGSQL","115","<T/C/Z"
"594","514.898002","::1","::1","TCP","64","49674  >  5432 [ACK] Seq=20086 Ack=5254 Win=8375 Len=0"
"595","519.917547","::1","::1","PGSQL","259",">Q"
"596","519.917763","::1","::1","TCP","64","5432  >  49674 [ACK] Seq=5254 Ack=20281 Win=8427 Len=0"
"597","519.918869","::1","::1","UDP","340","49667  >  49667 Len=288"
"598","519.919111","::1","::1","PGSQL","115","<T/C/Z"
"599","519.919259","::1","::1","TCP","64","49674  >  5432 [ACK] Seq=20281 Ack=5305 Win=8375 Len=0"
"600","524.955183","::1","::1","PGSQL","259",">Q"
"601","524.955358","::1","::1","TCP","64","5432  >  49674 [ACK] Seq=5305 Ack=20476 Win=8427 Len=0"
"602","524.956266","::1","::1","UDP","340","49667  >  49667 Len=288"
"603","524.956466","::1","::1","PGSQL","115","<T/C/Z"
"604","524.956571","::1","::1","TCP","64","49674  >  5432 [ACK] Seq=20476 Ack=5356 Win=8375 Len=0"
"605","529.980607","::1","::1","PGSQL","259",">Q"
"606","529.980759","::1","::1","TCP","64","5432  >  49674 [ACK] Seq=5356 Ack=20671 Win=8426 Len=0"
"607","529.981915","::1","::1","UDP","340","49667  >  49667 Len=288"
"608","529.982127","::1","::1","PGSQL","115","<T/C/Z"
"609","529.982245","::1","::1","TCP","64","49674  >  5432 [ACK] Seq=20671 Ack=5407 Win=8375 Len=0"
"610","532.772981","::1","::1","UDP","84","49667  >  49667 Len=32"
"611","532.966216","::1","::1","UDP","76","49667  >  49667 Len=24"
"612","532.972989","::1","::1","UDP","84","49667  >  49667 Len=32"
"613","533.013240","::1","::1","UDP","1012","49667  >  49667 Len=960"
"614","533.013302","::1","::1","UDP","452","49667  >  49667 Len=400"
"615","533.013340","::1","::1","UDP","564","49667  >  49667 Len=512"
"616","535.005627","::1","::1","PGSQL","259",">Q"
"617","535.005861","::1","::1","TCP","64","5432  >  49674 [ACK] Seq=5407 Ack=20866 Win=8425 Len=0"
"618","535.006942","::1","::1","UDP","340","49667  >  49667 Len=288"
"619","535.007171","::1","::1","PGSQL","115","<T/C/Z"
"620","535.007287","::1","::1","TCP","64","49674  >  5432 [ACK] Seq=20866 Ack=5458 Win=8374 Len=0"
"621","540.043753","::1","::1","PGSQL","259",">Q"
"622","540.043928","::1","::1","TCP","64","5432  >  49674 [ACK] Seq=5458 Ack=21061 Win=8424 Len=0"
"623","540.045021","::1","::1","UDP","340","49667  >  49667 Len=288"
"624","540.045391","::1","::1","PGSQL","115","<T/C/Z"
"625","540.045512","::1","::1","TCP","64","49674  >  5432 [ACK] Seq=21061 Ack=5509 Win=8374 Len=0"
"626","545.094792","::1","::1","PGSQL","259",">Q"
"627","545.094960","::1","::1","TCP","64","5432  >  49674 [ACK] Seq=5509 Ack=21256 Win=8424 Len=0"
"628","545.096064","::1","::1","UDP","340","49667  >  49667 Len=288"
"629","545.096340","::1","::1","PGSQL","115","<T/C/Z"
"630","545.096477","::1","::1","TCP","64","49674  >  5432 [ACK] Seq=21256 Ack=5560 Win=8374 Len=0"
"631","550.130276","::1","::1","PGSQL","259",">Q"
"632","550.130459","::1","::1","TCP","64","5432  >  49674 [ACK] Seq=5560 Ack=21451 Win=8423 Len=0"
"633","550.131590","::1","::1","UDP","340","49667  >  49667 Len=288"
"634","550.131836","::1","::1","PGSQL","115","<T/C/Z"
"635","550.131988","::1","::1","TCP","64","49674  >  5432 [ACK] Seq=21451 Ack=5611 Win=8374 Len=0"
"636","555.179386","::1","::1","PGSQL","259",">Q"
"637","555.179611","::1","::1","TCP","64","5432  >  49674 [ACK] Seq=5611 Ack=21646 Win=8422 Len=0"
"638","555.181020","::1","::1","UDP","340","49667  >  49667 Len=288"
"639","555.181275","::1","::1","PGSQL","115","<T/C/Z"
"640","555.181403","::1","::1","TCP","64","49674  >  5432 [ACK] Seq=21646 Ack=5662 Win=8374 Len=0"
"641","560.231058","::1","::1","PGSQL","259",">Q"
"642","560.231211","::1","::1","TCP","64","5432  >  49674 [ACK] Seq=5662 Ack=21841 Win=8421 Len=0"
"643","560.232275","::1","::1","UDP","340","49667  >  49667 Len=288"
"644","560.232503","::1","::1","PGSQL","115","<T/C/Z"
"645","560.232616","::1","::1","TCP","64","49674  >  5432 [ACK] Seq=21841 Ack=5713 Win=8373 Len=0"
"646","565.289335","::1","::1","PGSQL","259",">Q"
"647","565.289509","::1","::1","TCP","64","5432  >  49674 [ACK] Seq=5713 Ack=22036 Win=8421 Len=0"
"648","565.290522","::1","::1","UDP","340","49667  >  49667 Len=288"
"649","565.290763","::1","::1","PGSQL","115","<T/C/Z"
"650","565.290901","::1","::1","TCP","64","49674  >  5432 [ACK] Seq=22036 Ack=5764 Win=8373 Len=0"
"651","570.350833","::1","::1","PGSQL","259",">Q"
"652","570.350912","::1","::1","TCP","64","5432  >  49674 [ACK] Seq=5764 Ack=22231 Win=8420 Len=0"
"653","570.351475","::1","::1","UDP","340","49667  >  49667 Len=288"
"654","570.351627","::1","::1","PGSQL","115","<T/C/Z"
"655","570.351682","::1","::1","TCP","64","49674  >  5432 [ACK] Seq=22231 Ack=5815 Win=8373 Len=0"
"656","575.398433","::1","::1","PGSQL","259",">Q"
"657","575.398575","::1","::1","TCP","64","5432  >  49674 [ACK] Seq=5815 Ack=22426 Win=8419 Len=0"
"658","575.399507","::1","::1","UDP","340","49667  >  49667 Len=288"
"659","575.399684","::1","::1","PGSQL","115","<T/C/Z"
"660","575.399777","::1","::1","TCP","64","49674  >  5432 [ACK] Seq=22426 Ack=5866 Win=8373 Len=0"
"661","580.455730","::1","::1","PGSQL","259",">Q"
"662","580.455865","::1","::1","TCP","64","5432  >  49674 [ACK] Seq=5866 Ack=22621 Win=8418 Len=0"
"663","580.456786","::1","::1","UDP","340","49667  >  49667 Len=288"
"664","580.456973","::1","::1","PGSQL","115","<T/C/Z"
"665","580.457096","::1","::1","TCP","64","49674  >  5432 [ACK] Seq=22621 Ack=5917 Win=8373 Len=0"
"666","585.479790","::1","::1","PGSQL","259",">Q"
"667","585.479982","::1","::1","TCP","64","5432  >  49674 [ACK] Seq=5917 Ack=22816 Win=8418 Len=0"
"668","585.481089","::1","::1","UDP","340","49667  >  49667 Len=288"
"669","585.481310","::1","::1","PGSQL","115","<T/C/Z"
"670","585.481424","::1","::1","TCP","64","49674  >  5432 [ACK] Seq=22816 Ack=5968 Win=8373 Len=0"
"671","590.302366","::1","::1","UDP","140","49667  >  49667 Len=88"
"672","590.536093","::1","::1","PGSQL","259",">Q"
"673","590.536303","::1","::1","TCP","64","5432  >  49674 [ACK] Seq=5968 Ack=23011 Win=8417 Len=0"
"674","590.537500","::1","::1","UDP","340","49667  >  49667 Len=288"
"675","590.537809","::1","::1","PGSQL","115","<T/C/Z"
"676","590.537962","::1","::1","TCP","64","49674  >  5432 [ACK] Seq=23011 Ack=6019 Win=8372 Len=0"
"677","592.883309","::1","::1","UDP","84","49667  >  49667 Len=32"
"678","593.030035","::1","::1","UDP","76","49667  >  49667 Len=24"
"679","593.037483","::1","::1","UDP","84","49667  >  49667 Len=32"
"680","593.072690","::1","::1","UDP","1012","49667  >  49667 Len=960"
"681","593.072769","::1","::1","UDP","452","49667  >  49667 Len=400"
"682","593.072810","::1","::1","UDP","564","49667  >  49667 Len=512"
"683","595.578434","::1","::1","PGSQL","259",">Q"
"684","595.578522","::1","::1","TCP","64","5432  >  49674 [ACK] Seq=6019 Ack=23206 Win=8416 Len=0"
"685","595.578816","::1","::1","UDP","340","49667  >  49667 Len=288"
"686","595.578884","::1","::1","PGSQL","115","<T/C/Z"
"687","595.578923","::1","::1","TCP","64","49674  >  5432 [ACK] Seq=23206 Ack=6070 Win=8372 Len=0"
"688","600.619001","::1","::1","PGSQL","259",">Q"
"689","600.619102","::1","::1","TCP","64","5432  >  49674 [ACK] Seq=6070 Ack=23401 Win=8415 Len=0"
"690","600.619466","::1","::1","UDP","340","49667  >  49667 Len=288"
"691","600.619537","::1","::1","PGSQL","115","<T/C/Z"
"692","600.619581","::1","::1","TCP","64","49674  >  5432 [ACK] Seq=23401 Ack=6121 Win=8372 Len=0"
"693","605.677397","::1","::1","PGSQL","259",">Q"
"694","605.677452","::1","::1","TCP","64","5432  >  49674 [ACK] Seq=6121 Ack=23596 Win=8415 Len=0"
"695","605.677819","::1","::1","UDP","340","49667  >  49667 Len=288"
"696","605.677888","::1","::1","PGSQL","115","<T/C/Z"
"697","605.677926","::1","::1","TCP","64","49674  >  5432 [ACK] Seq=23596 Ack=6172 Win=8372 Len=0"
"698","610.736874","::1","::1","PGSQL","259",">Q"
"699","610.736939","::1","::1","TCP","64","5432  >  49674 [ACK] Seq=6172 Ack=23791 Win=8414 Len=0"
"700","610.737326","::1","::1","UDP","340","49667  >  49667 Len=288"
"701","610.737392","::1","::1","PGSQL","115","<T/C/Z"
"702","610.737434","::1","::1","TCP","64","49674  >  5432 [ACK] Seq=23791 Ack=6223 Win=8372 Len=0"
"703","615.789748","::1","::1","PGSQL","259",">Q"
"704","615.789812","::1","::1","TCP","64","5432  >  49674 [ACK] Seq=6223 Ack=23986 Win=8413 Len=0"
"705","615.790246","::1","::1","UDP","340","49667  >  49667 Len=288"
"706","615.790347","::1","::1","PGSQL","115","<T/C/Z"
"707","615.790388","::1","::1","TCP","64","49674  >  5432 [ACK] Seq=23986 Ack=6274 Win=8371 Len=0"
"708","620.839494","::1","::1","PGSQL","259",">Q"
"709","620.839544","::1","::1","TCP","64","5432  >  49674 [ACK] Seq=6274 Ack=24181 Win=8412 Len=0"
"710","620.840019","::1","::1","UDP","340","49667  >  49667 Len=288"
"711","620.840091","::1","::1","PGSQL","115","<T/C/Z"
"712","620.840122","::1","::1","TCP","64","49674  >  5432 [ACK] Seq=24181 Ack=6325 Win=8371 Len=0"
"713","625.895595","::1","::1","PGSQL","259",">Q"
"714","625.895667","::1","::1","TCP","64","5432  >  49674 [ACK] Seq=6325 Ack=24376 Win=8411 Len=0"
"715","625.896199","::1","::1","UDP","340","49667  >  49667 Len=288"
"716","625.896274","::1","::1","PGSQL","115","<T/C/Z"
"717","625.896316","::1","::1","TCP","64","49674  >  5432 [ACK] Seq=24376 Ack=6376 Win=8371 Len=0"
"718","630.947508","::1","::1","PGSQL","259",">Q"
"719","630.947614","::1","::1","TCP","64","5432  >  49674 [ACK] Seq=6376 Ack=24571 Win=8411 Len=0"
"720","630.948554","::1","::1","UDP","340","49667  >  49667 Len=288"
"721","630.948925","::1","::1","PGSQL","115","<T/C/Z"
"722","630.949008","::1","::1","TCP","64","49674  >  5432 [ACK] Seq=24571 Ack=6427 Win=8371 Len=0"
"723","636.005239","::1","::1","PGSQL","259",">Q"
"724","636.005286","::1","::1","TCP","64","5432  >  49674 [ACK] Seq=6427 Ack=24766 Win=8410 Len=0"
"725","636.005670","::1","::1","UDP","340","49667  >  49667 Len=288"
"726","636.005766","::1","::1","PGSQL","115","<T/C/Z"
"727","636.005827","::1","::1","TCP","64","49674  >  5432 [ACK] Seq=24766 Ack=6478 Win=8371 Len=0"
"728","641.040123","::1","::1","PGSQL","259",">Q"
"729","641.040172","::1","::1","TCP","64","5432  >  49674 [ACK] Seq=6478 Ack=24961 Win=8409 Len=0"
"730","641.040595","::1","::1","UDP","340","49667  >  49667 Len=288"
"731","641.040669","::1","::1","PGSQL","115","<T/C/Z"
"732","641.040715","::1","::1","TCP","64","49674  >  5432 [ACK] Seq=24961 Ack=6529 Win=8370 Len=0"
"733","646.255581","::1","::1","PGSQL","259",">Q"
"734","646.255636","::1","::1","TCP","64","5432  >  49674 [ACK] Seq=6529 Ack=25156 Win=8408 Len=0"
"735","646.256100","::1","::1","UDP","340","49667  >  49667 Len=288"
"736","646.256188","::1","::1","PGSQL","115","<T/C/Z"
"737","646.256236","::1","::1","TCP","64","49674  >  5432 [ACK] Seq=25156 Ack=6580 Win=8370 Len=0"
"738","651.319608","::1","::1","PGSQL","259",">Q"
"739","651.319658","::1","::1","TCP","64","5432  >  49674 [ACK] Seq=6580 Ack=25351 Win=8408 Len=0"
"740","651.320088","::1","::1","UDP","340","49667  >  49667 Len=288"
"741","651.320165","::1","::1","PGSQL","115","<T/C/Z"
"742","651.320210","::1","::1","TCP","64","49674  >  5432 [ACK] Seq=25351 Ack=6631 Win=8370 Len=0"
"743","652.891286","::1","::1","UDP","84","49667  >  49667 Len=32"
"744","653.175393","::1","::1","UDP","76","49667  >  49667 Len=24"
"745","653.185717","::1","::1","UDP","84","49667  >  49667 Len=32"
"746","653.244908","::1","::1","UDP","1012","49667  >  49667 Len=960"
"747","653.244983","::1","::1","UDP","452","49667  >  49667 Len=400"
"748","653.245034","::1","::1","UDP","564","49667  >  49667 Len=512"
"749","656.429781","::1","::1","PGSQL","259",">Q"
"750","656.429893","::1","::1","TCP","64","5432  >  49674 [ACK] Seq=6631 Ack=25546 Win=8407 Len=0"
"751","656.430720","::1","::1","UDP","340","49667  >  49667 Len=288"
"752","656.430886","::1","::1","PGSQL","115","<T/C/Z"
"753","656.431011","::1","::1","TCP","64","49674  >  5432 [ACK] Seq=25546 Ack=6682 Win=8370 Len=0"
"754","661.484032","::1","::1","PGSQL","259",">Q"
"755","661.484145","::1","::1","TCP","64","5432  >  49674 [ACK] Seq=6682 Ack=25741 Win=8406 Len=0"
"756","661.484904","::1","::1","UDP","340","49667  >  49667 Len=288"
"757","661.485093","::1","::1","PGSQL","115","<T/C/Z"
"758","661.485211","::1","::1","TCP","64","49674  >  5432 [ACK] Seq=25741 Ack=6733 Win=8370 Len=0"
"759","666.530835","::1","::1","PGSQL","259",">Q"
"760","666.530940","::1","::1","TCP","64","5432  >  49674 [ACK] Seq=6733 Ack=25936 Win=8405 Len=0"
"761","666.531847","::1","::1","UDP","340","49667  >  49667 Len=288"
"762","666.532205","::1","::1","PGSQL","115","<T/C/Z"
"763","666.532321","::1","::1","TCP","64","49674  >  5432 [ACK] Seq=25936 Ack=6784 Win=8369 Len=0"
"764","671.572851","::1","::1","PGSQL","259",">Q"
"765","671.572974","::1","::1","TCP","64","5432  >  49674 [ACK] Seq=6784 Ack=26131 Win=8405 Len=0"
"766","671.574043","::1","::1","UDP","340","49667  >  49667 Len=288"
"767","671.574243","::1","::1","PGSQL","115","<T/C/Z"
"768","671.574360","::1","::1","TCP","64","49674  >  5432 [ACK] Seq=26131 Ack=6835 Win=8369 Len=0"
"769","676.648394","::1","::1","PGSQL","259",">Q"
"770","676.648451","::1","::1","TCP","64","5432  >  49674 [ACK] Seq=6835 Ack=26326 Win=8404 Len=0"
"771","676.648909","::1","::1","UDP","340","49667  >  49667 Len=288"
"772","676.648988","::1","::1","PGSQL","115","<T/C/Z"
"773","676.649032","::1","::1","TCP","64","49674  >  5432 [ACK] Seq=26326 Ack=6886 Win=8369 Len=0"
"774","681.704402","::1","::1","PGSQL","259",">Q"
"775","681.704444","::1","::1","TCP","64","5432  >  49674 [ACK] Seq=6886 Ack=26521 Win=8403 Len=0"
"776","681.704838","::1","::1","UDP","340","49667  >  49667 Len=288"
"777","681.704928","::1","::1","PGSQL","115","<T/C/Z"
"778","681.704970","::1","::1","TCP","64","49674  >  5432 [ACK] Seq=26521 Ack=6937 Win=8369 Len=0"
"779","686.754942","::1","::1","PGSQL","259",">Q"
"780","686.754992","::1","::1","TCP","64","5432  >  49674 [ACK] Seq=6937 Ack=26716 Win=8402 Len=0"
"781","686.755366","::1","::1","UDP","340","49667  >  49667 Len=288"
"782","686.755459","::1","::1","PGSQL","115","<T/C/Z"
"783","686.755512","::1","::1","TCP","64","49674  >  5432 [ACK] Seq=26716 Ack=6988 Win=8369 Len=0"
"784","691.823670","::1","::1","PGSQL","259",">Q"
"785","691.823760","::1","::1","TCP","64","5432  >  49674 [ACK] Seq=6988 Ack=26911 Win=8402 Len=0"
"786","691.824425","::1","::1","UDP","340","49667  >  49667 Len=288"
"787","691.824542","::1","::1","PGSQL","115","<T/C/Z"
"788","691.824595","::1","::1","TCP","64","49674  >  5432 [ACK] Seq=26911 Ack=7039 Win=8368 Len=0"
"789","696.873944","::1","::1","PGSQL","259",">Q"
"790","696.874016","::1","::1","TCP","64","5432  >  49674 [ACK] Seq=7039 Ack=27106 Win=8401 Len=0"
"791","696.874484","::1","::1","UDP","340","49667  >  49667 Len=288"
"792","696.874599","::1","::1","PGSQL","115","<T/C/Z"
"793","696.874669","::1","::1","TCP","64","49674  >  5432 [ACK] Seq=27106 Ack=7090 Win=8368 Len=0"
"794","701.922835","::1","::1","PGSQL","259",">Q"
"795","701.922911","::1","::1","TCP","64","5432  >  49674 [ACK] Seq=7090 Ack=27301 Win=8400 Len=0"
"796","701.923436","::1","::1","UDP","340","49667  >  49667 Len=288"
"797","701.923555","::1","::1","PGSQL","115","<T/C/Z"
"798","701.923673","::1","::1","TCP","64","49674  >  5432 [ACK] Seq=27301 Ack=7141 Win=8368 Len=0"
"799","706.971585","::1","::1","PGSQL","259",">Q"
"800","706.971699","::1","::1","TCP","64","5432  >  49674 [ACK] Seq=7141 Ack=27496 Win=8399 Len=0"
"801","706.972725","::1","::1","UDP","340","49667  >  49667 Len=288"
"802","706.973015","::1","::1","PGSQL","115","<T/C/Z"
"803","706.973142","::1","::1","TCP","64","49674  >  5432 [ACK] Seq=27496 Ack=7192 Win=8368 Len=0"
"804","712.033687","::1","::1","PGSQL","259",">Q"
"805","712.033850","::1","::1","TCP","64","5432  >  49674 [ACK] Seq=7192 Ack=27691 Win=8399 Len=0"
"806","712.034727","::1","::1","UDP","340","49667  >  49667 Len=288"
"807","712.034920","::1","::1","PGSQL","115","<T/C/Z"
"808","712.035041","::1","::1","TCP","64","49674  >  5432 [ACK] Seq=27691 Ack=7243 Win=8368 Len=0"
"809","712.891688","::1","::1","UDP","84","49667  >  49667 Len=32"
"810","713.068222","::1","::1","UDP","76","49667  >  49667 Len=24"
"811","713.075640","::1","::1","UDP","84","49667  >  49667 Len=32"
"812","713.123076","::1","::1","UDP","1012","49667  >  49667 Len=960"
"813","713.123142","::1","::1","UDP","452","49667  >  49667 Len=400"
"814","713.123183","::1","::1","UDP","564","49667  >  49667 Len=512"
"815","717.095660","::1","::1","PGSQL","259",">Q"
"816","717.095775","::1","::1","TCP","64","5432  >  49674 [ACK] Seq=7243 Ack=27886 Win=8398 Len=0"
"817","717.096687","::1","::1","UDP","340","49667  >  49667 Len=288"
"818","717.096901","::1","::1","PGSQL","115","<T/C/Z"
"819","717.097045","::1","::1","TCP","64","49674  >  5432 [ACK] Seq=27886 Ack=7294 Win=8367 Len=0"
"820","722.163115","::1","::1","PGSQL","259",">Q"
"821","722.163277","::1","::1","TCP","64","5432  >  49674 [ACK] Seq=7294 Ack=28081 Win=8397 Len=0"
"822","722.164415","::1","::1","UDP","340","49667  >  49667 Len=288"
"823","722.164623","::1","::1","PGSQL","115","<T/C/Z"
"824","722.164737","::1","::1","TCP","64","49674  >  5432 [ACK] Seq=28081 Ack=7345 Win=8367 Len=0"
"825","727.211320","::1","::1","PGSQL","259",">Q"
"826","727.211503","::1","::1","TCP","64","5432  >  49674 [ACK] Seq=7345 Ack=28276 Win=8396 Len=0"
"827","727.212471","::1","::1","UDP","340","49667  >  49667 Len=288"
"828","727.212692","::1","::1","PGSQL","115","<T/C/Z"
"829","727.212838","::1","::1","TCP","64","49674  >  5432 [ACK] Seq=28276 Ack=7396 Win=8367 Len=0"
"830","732.258945","::1","::1","PGSQL","259",">Q"
"831","732.259062","::1","::1","TCP","64","5432  >  49674 [ACK] Seq=7396 Ack=28471 Win=8395 Len=0"
"832","732.260416","::1","::1","UDP","340","49667  >  49667 Len=288"
"833","732.260744","::1","::1","PGSQL","115","<T/C/Z"
"834","732.260952","::1","::1","TCP","64","49674  >  5432 [ACK] Seq=28471 Ack=7447 Win=8367 Len=0"
"835","737.316984","::1","::1","PGSQL","259",">Q"
"836","737.317040","::1","::1","TCP","64","5432  >  49674 [ACK] Seq=7447 Ack=28666 Win=8395 Len=0"
"837","737.317549","::1","::1","UDP","340","49667  >  49667 Len=288"
"838","737.317621","::1","::1","PGSQL","115","<T/C/Z"
"839","737.317655","::1","::1","TCP","64","49674  >  5432 [ACK] Seq=28666 Ack=7498 Win=8367 Len=0"
"840","742.380968","::1","::1","PGSQL","259",">Q"
"841","742.381115","::1","::1","TCP","64","5432  >  49674 [ACK] Seq=7498 Ack=28861 Win=8394 Len=0"
"842","742.382117","::1","::1","UDP","340","49667  >  49667 Len=288"
"843","742.382311","::1","::1","PGSQL","115","<T/C/Z"
"844","742.382429","::1","::1","TCP","64","49674  >  5432 [ACK] Seq=28861 Ack=7549 Win=8366 Len=0"
"845","747.435070","::1","::1","PGSQL","259",">Q"
"846","747.435130","::1","::1","TCP","64","5432  >  49674 [ACK] Seq=7549 Ack=29056 Win=8393 Len=0"
"847","747.435607","::1","::1","UDP","340","49667  >  49667 Len=288"
"848","747.435695","::1","::1","PGSQL","115","<T/C/Z"
"849","747.435752","::1","::1","TCP","64","49674  >  5432 [ACK] Seq=29056 Ack=7600 Win=8366 Len=0"
"850","752.491047","::1","::1","PGSQL","259",">Q"
"851","752.491112","::1","::1","TCP","64","5432  >  49674 [ACK] Seq=7600 Ack=29251 Win=8392 Len=0"
"852","752.491732","::1","::1","UDP","340","49667  >  49667 Len=288"
"853","752.491892","::1","::1","PGSQL","115","<T/C/Z"
"854","752.491967","::1","::1","TCP","64","49674  >  5432 [ACK] Seq=29251 Ack=7651 Win=8366 Len=0"
"855","757.545878","::1","::1","PGSQL","259",">Q"
"856","757.546035","::1","::1","TCP","64","5432  >  49674 [ACK] Seq=7651 Ack=29446 Win=8392 Len=0"
"857","757.547088","::1","::1","UDP","340","49667  >  49667 Len=288"
"858","757.547286","::1","::1","PGSQL","115","<T/C/Z"
"859","757.547394","::1","::1","TCP","64","49674  >  5432 [ACK] Seq=29446 Ack=7702 Win=8366 Len=0"
"860","762.598746","::1","::1","PGSQL","259",">Q"
"861","762.598846","::1","::1","TCP","64","5432  >  49674 [ACK] Seq=7702 Ack=29641 Win=8391 Len=0"
"862","762.599365","::1","::1","UDP","340","49667  >  49667 Len=288"
"863","762.599482","::1","::1","PGSQL","115","<T/C/Z"
"864","762.599577","::1","::1","TCP","64","49674  >  5432 [ACK] Seq=29641 Ack=7753 Win=8366 Len=0"
"865","767.649123","::1","::1","PGSQL","259",">Q"
"866","767.649216","::1","::1","TCP","64","5432  >  49674 [ACK] Seq=7753 Ack=29836 Win=8390 Len=0"
"867","767.649685","::1","::1","UDP","340","49667  >  49667 Len=288"
"868","767.649786","::1","::1","PGSQL","115","<T/C/Z"
"869","767.649854","::1","::1","TCP","64","49674  >  5432 [ACK] Seq=29836 Ack=7804 Win=8365 Len=0"
"870","772.703783","::1","::1","PGSQL","259",">Q"
"871","772.703924","::1","::1","TCP","64","5432  >  49674 [ACK] Seq=7804 Ack=30031 Win=8389 Len=0"
"872","772.704919","::1","::1","UDP","340","49667  >  49667 Len=288"
"873","772.705123","::1","::1","PGSQL","115","<T/C/Z"
"874","772.705238","::1","::1","TCP","64","49674  >  5432 [ACK] Seq=30031 Ack=7855 Win=8365 Len=0"
"875","772.893676","::1","::1","UDP","84","49667  >  49667 Len=32"
"876","773.205219","::1","::1","UDP","76","49667  >  49667 Len=24"
"877","773.212831","::1","::1","UDP","84","49667  >  49667 Len=32"
"878","773.264698","::1","::1","UDP","1012","49667  >  49667 Len=960"
"879","773.264760","::1","::1","UDP","452","49667  >  49667 Len=400"
"880","773.264796","::1","::1","UDP","564","49667  >  49667 Len=512"
"881","777.759828","::1","::1","PGSQL","259",">Q"
"882","777.759957","::1","::1","TCP","64","5432  >  49674 [ACK] Seq=7855 Ack=30226 Win=8389 Len=0"
"883","777.760763","::1","::1","UDP","340","49667  >  49667 Len=288"
"884","777.760931","::1","::1","PGSQL","115","<T/C/Z"
"885","777.761052","::1","::1","TCP","64","49674  >  5432 [ACK] Seq=30226 Ack=7906 Win=8365 Len=0"
"886","782.818193","::1","::1","PGSQL","259",">Q"
"887","782.818385","::1","::1","TCP","64","5432  >  49674 [ACK] Seq=7906 Ack=30421 Win=8388 Len=0"
"888","782.819583","::1","::1","UDP","340","49667  >  49667 Len=288"
"889","782.819940","::1","::1","PGSQL","115","<T/C/Z"
"890","782.820071","::1","::1","TCP","64","49674  >  5432 [ACK] Seq=30421 Ack=7957 Win=8365 Len=0"
"891","787.878056","::1","::1","PGSQL","259",">Q"
"892","787.878226","::1","::1","TCP","64","5432  >  49674 [ACK] Seq=7957 Ack=30616 Win=8387 Len=0"
"893","787.879387","::1","::1","UDP","340","49667  >  49667 Len=288"
"894","787.879619","::1","::1","PGSQL","115","<T/C/Z"
"895","787.879739","::1","::1","TCP","64","49674  >  5432 [ACK] Seq=30616 Ack=8008 Win=8365 Len=0"
"896","792.939903","::1","::1","PGSQL","259",">Q"
"897","792.939983","::1","::1","TCP","64","5432  >  49674 [ACK] Seq=8008 Ack=30811 Win=8386 Len=0"
"898","792.940540","::1","::1","UDP","340","49667  >  49667 Len=288"
"899","792.940658","::1","::1","PGSQL","115","<T/C/Z"
"900","792.940734","::1","::1","TCP","64","49674  >  5432 [ACK] Seq=30811 Ack=8059 Win=8364 Len=0"
"901","798.000099","::1","::1","PGSQL","259",">Q"
"902","798.000305","::1","::1","TCP","64","5432  >  49674 [ACK] Seq=8059 Ack=31006 Win=8386 Len=0"
"903","798.001586","::1","::1","UDP","340","49667  >  49667 Len=288"
"904","798.001783","::1","::1","PGSQL","115","<T/C/Z"
"905","798.001896","::1","::1","TCP","64","49674  >  5432 [ACK] Seq=31006 Ack=8110 Win=8364 Len=0"
"906","803.057622","::1","::1","PGSQL","259",">Q"
"907","803.057766","::1","::1","TCP","64","5432  >  49674 [ACK] Seq=8110 Ack=31201 Win=8385 Len=0"
"908","803.058628","::1","::1","UDP","340","49667  >  49667 Len=288"
"909","803.058831","::1","::1","PGSQL","115","<T/C/Z"
"910","803.058930","::1","::1","TCP","64","49674  >  5432 [ACK] Seq=31201 Ack=8161 Win=8364 Len=0"
"911","808.116356","::1","::1","PGSQL","259",">Q"
"912","808.116504","::1","::1","TCP","64","5432  >  49674 [ACK] Seq=8161 Ack=31396 Win=8384 Len=0"
"913","808.117591","::1","::1","UDP","340","49667  >  49667 Len=288"
"914","808.117827","::1","::1","PGSQL","115","<T/C/Z"
"915","808.117935","::1","::1","TCP","64","49674  >  5432 [ACK] Seq=31396 Ack=8212 Win=8364 Len=0"
"916","813.165712","::1","::1","PGSQL","259",">Q"
"917","813.165916","::1","::1","TCP","64","5432  >  49674 [ACK] Seq=8212 Ack=31591 Win=8383 Len=0"
"918","813.167026","::1","::1","UDP","340","49667  >  49667 Len=288"
"919","813.167308","::1","::1","PGSQL","115","<T/C/Z"
"920","813.167470","::1","::1","TCP","64","49674  >  5432 [ACK] Seq=31591 Ack=8263 Win=8364 Len=0"
"921","818.218153","::1","::1","PGSQL","259",">Q"
"922","818.218287","::1","::1","TCP","64","5432  >  49674 [ACK] Seq=8263 Ack=31786 Win=8383 Len=0"
"923","818.219381","::1","::1","UDP","340","49667  >  49667 Len=288"
"924","818.219640","::1","::1","PGSQL","115","<T/C/Z"
"925","818.219801","::1","::1","TCP","64","49674  >  5432 [ACK] Seq=31786 Ack=8314 Win=8363 Len=0"
"926","823.270713","::1","::1","PGSQL","259",">Q"
"927","823.270856","::1","::1","TCP","64","5432  >  49674 [ACK] Seq=8314 Ack=31981 Win=8382 Len=0"
"928","823.271796","::1","::1","UDP","340","49667  >  49667 Len=288"
"929","823.272011","::1","::1","PGSQL","115","<T/C/Z"
"930","823.272117","::1","::1","TCP","64","49674  >  5432 [ACK] Seq=31981 Ack=8365 Win=8363 Len=0"
"931","828.322120","::1","::1","PGSQL","259",">Q"
"932","828.322300","::1","::1","TCP","64","5432  >  49674 [ACK] Seq=8365 Ack=32176 Win=8381 Len=0"
"933","828.323311","::1","::1","UDP","340","49667  >  49667 Len=288"
"934","828.323504","::1","::1","PGSQL","115","<T/C/Z"
"935","828.323609","::1","::1","TCP","64","49674  >  5432 [ACK] Seq=32176 Ack=8416 Win=8363 Len=0"
"936","832.897155","::1","::1","UDP","84","49667  >  49667 Len=32"
"937","833.078882","::1","::1","UDP","76","49667  >  49667 Len=24"
"938","833.085791","::1","::1","UDP","84","49667  >  49667 Len=32"
"939","833.129414","::1","::1","UDP","1012","49667  >  49667 Len=960"
"940","833.129501","::1","::1","UDP","452","49667  >  49667 Len=400"
"941","833.129553","::1","::1","UDP","564","49667  >  49667 Len=512"
"942","833.377909","::1","::1","PGSQL","259",">Q"
"943","833.378068","::1","::1","TCP","64","5432  >  49674 [ACK] Seq=8416 Ack=32371 Win=8380 Len=0"
"944","833.379072","::1","::1","UDP","340","49667  >  49667 Len=288"
"945","833.379276","::1","::1","PGSQL","115","<T/C/Z"
"946","833.379425","::1","::1","TCP","64","49674  >  5432 [ACK] Seq=32371 Ack=8467 Win=8363 Len=0"
"947","838.428418","::1","::1","PGSQL","259",">Q"
"948","838.428516","::1","::1","TCP","64","5432  >  49674 [ACK] Seq=8467 Ack=32566 Win=8379 Len=0"
"949","838.429453","::1","::1","UDP","340","49667  >  49667 Len=288"
"950","838.429629","::1","::1","PGSQL","115","<T/C/Z"
"951","838.429733","::1","::1","TCP","64","49674  >  5432 [ACK] Seq=32566 Ack=8518 Win=8363 Len=0"
"952","843.482290","::1","::1","PGSQL","259",">Q"
"953","843.482488","::1","::1","TCP","64","5432  >  49674 [ACK] Seq=8518 Ack=32761 Win=8379 Len=0"
"954","843.483549","::1","::1","UDP","340","49667  >  49667 Len=288"
"955","843.483751","::1","::1","PGSQL","115","<T/C/Z"
"956","843.483854","::1","::1","TCP","64","49674  >  5432 [ACK] Seq=32761 Ack=8569 Win=8362 Len=0"
"957","848.528097","::1","::1","PGSQL","259",">Q"
"958","848.528328","::1","::1","TCP","64","5432  >  49674 [ACK] Seq=8569 Ack=32956 Win=8378 Len=0"
"959","848.529711","::1","::1","UDP","340","49667  >  49667 Len=288"
"960","848.529956","::1","::1","PGSQL","115","<T/C/Z"
"961","848.530095","::1","::1","TCP","64","49674  >  5432 [ACK] Seq=32956 Ack=8620 Win=8362 Len=0"
"962","853.580189","::1","::1","PGSQL","259",">Q"
"963","853.580412","::1","::1","TCP","64","5432  >  49674 [ACK] Seq=8620 Ack=33151 Win=8377 Len=0"
"964","853.581722","::1","::1","UDP","340","49667  >  49667 Len=288"
"965","853.581977","::1","::1","PGSQL","115","<T/C/Z"
"966","853.582147","::1","::1","TCP","64","49674  >  5432 [ACK] Seq=33151 Ack=8671 Win=8362 Len=0"
"967","858.641582","::1","::1","PGSQL","259",">Q"
"968","858.641689","::1","::1","TCP","64","5432  >  49674 [ACK] Seq=8671 Ack=33346 Win=8376 Len=0"
"969","858.642592","::1","::1","UDP","340","49667  >  49667 Len=288"
"970","858.642782","::1","::1","PGSQL","115","<T/C/Z"
"971","858.642877","::1","::1","TCP","64","49674  >  5432 [ACK] Seq=33346 Ack=8722 Win=8362 Len=0"
"972","863.683765","::1","::1","PGSQL","259",">Q"
"973","863.683990","::1","::1","TCP","64","5432  >  49674 [ACK] Seq=8722 Ack=33541 Win=8376 Len=0"
"974","863.684961","::1","::1","UDP","340","49667  >  49667 Len=288"
"975","863.685191","::1","::1","PGSQL","115","<T/C/Z"
"976","863.685310","::1","::1","TCP","64","49674  >  5432 [ACK] Seq=33541 Ack=8773 Win=8362 Len=0"
"977","868.735099","::1","::1","PGSQL","259",">Q"
"978","868.735305","::1","::1","TCP","64","5432  >  49674 [ACK] Seq=8773 Ack=33736 Win=8375 Len=0"
"979","868.736337","::1","::1","UDP","340","49667  >  49667 Len=288"
"980","868.736537","::1","::1","PGSQL","115","<T/C/Z"
"981","868.736649","::1","::1","TCP","64","49674  >  5432 [ACK] Seq=33736 Ack=8824 Win=8361 Len=0"
"982","873.788249","::1","::1","PGSQL","259",">Q"
"983","873.788436","::1","::1","TCP","64","5432  >  49674 [ACK] Seq=8824 Ack=33931 Win=8374 Len=0"
"984","873.789354","::1","::1","UDP","340","49667  >  49667 Len=288"
"985","873.789574","::1","::1","PGSQL","115","<T/C/Z"
"986","873.789727","::1","::1","TCP","64","49674  >  5432 [ACK] Seq=33931 Ack=8875 Win=8361 Len=0"
"987","878.845105","::1","::1","PGSQL","259",">Q"
"988","878.845205","::1","::1","TCP","64","5432  >  49674 [ACK] Seq=8875 Ack=34126 Win=8373 Len=0"
"989","878.845948","::1","::1","UDP","340","49667  >  49667 Len=288"
"990","878.846068","::1","::1","PGSQL","115","<T/C/Z"
"991","878.846151","::1","::1","TCP","64","49674  >  5432 [ACK] Seq=34126 Ack=8926 Win=8361 Len=0"
"992","883.901273","::1","::1","PGSQL","259",">Q"
"993","883.901412","::1","::1","TCP","64","5432  >  49674 [ACK] Seq=8926 Ack=34321 Win=8373 Len=0"
"994","883.902370","::1","::1","UDP","340","49667  >  49667 Len=288"
"995","883.902569","::1","::1","PGSQL","115","<T/C/Z"
"996","883.902713","::1","::1","TCP","64","49674  >  5432 [ACK] Seq=34321 Ack=8977 Win=8361 Len=0"
"997","888.961849","::1","::1","PGSQL","259",">Q"
"998","888.962017","::1","::1","TCP","64","5432  >  49674 [ACK] Seq=8977 Ack=34516 Win=8372 Len=0"
"999","888.963392","::1","::1","UDP","340","49667  >  49667 Len=288"
"1000","888.963641","::1","::1","PGSQL","115","<T/C/Z"
"1001","888.963782","::1","::1","TCP","64","49674  >  5432 [ACK] Seq=34516 Ack=9028 Win=8361 Len=0"
"1002","890.316057","::1","::1","UDP","140","49667  >  49667 Len=88"
"1003","892.899720","::1","::1","UDP","84","49667  >  49667 Len=32"
"1004","893.082047","::1","::1","UDP","76","49667  >  49667 Len=24"
"1005","893.089675","::1","::1","UDP","84","49667  >  49667 Len=32"
"1006","893.135967","::1","::1","UDP","1012","49667  >  49667 Len=960"
"1007","893.136028","::1","::1","UDP","452","49667  >  49667 Len=400"
"1008","893.136063","::1","::1","UDP","564","49667  >  49667 Len=512"
"1009","894.022351","::1","::1","PGSQL","259",">Q"
"1010","894.022525","::1","::1","TCP","64","5432  >  49674 [ACK] Seq=9028 Ack=34711 Win=8371 Len=0"
"1011","894.023322","::1","::1","UDP","340","49667  >  49667 Len=288"
"1012","894.023504","::1","::1","PGSQL","115","<T/C/Z"
"1013","894.023590","::1","::1","TCP","64","49674  >  5432 [ACK] Seq=34711 Ack=9079 Win=8360 Len=0"
"1014","899.077025","::1","::1","PGSQL","259",">Q"
"1015","899.077171","::1","::1","TCP","64","5432  >  49674 [ACK] Seq=9079 Ack=34906 Win=8370 Len=0"
"1016","899.078242","::1","::1","UDP","340","49667  >  49667 Len=288"
"1017","899.078483","::1","::1","PGSQL","115","<T/C/Z"
"1018","899.078610","::1","::1","TCP","64","49674  >  5432 [ACK] Seq=34906 Ack=9130 Win=8360 Len=0"
"1019","904.132123","::1","::1","PGSQL","259",">Q"
"1020","904.132286","::1","::1","TCP","64","5432  >  49674 [ACK] Seq=9130 Ack=35101 Win=8370 Len=0"
"1021","904.133715","::1","::1","UDP","340","49667  >  49667 Len=288"
"1022","904.133976","::1","::1","PGSQL","115","<T/C/Z"
"1023","904.134089","::1","::1","TCP","64","49674  >  5432 [ACK] Seq=35101 Ack=9181 Win=8360 Len=0"
"1024","909.193258","::1","::1","PGSQL","259",">Q"
"1025","909.193401","::1","::1","TCP","64","5432  >  49674 [ACK] Seq=9181 Ack=35296 Win=8369 Len=0"
"1026","909.194390","::1","::1","UDP","340","49667  >  49667 Len=288"
"1027","909.194602","::1","::1","PGSQL","115","<T/C/Z"
"1028","909.194747","::1","::1","TCP","64","49674  >  5432 [ACK] Seq=35296 Ack=9232 Win=8360 Len=0"
"1029","914.248091","::1","::1","PGSQL","259",">Q"
"1030","914.248232","::1","::1","TCP","64","5432  >  49674 [ACK] Seq=9232 Ack=35491 Win=8368 Len=0"
"1031","914.249350","::1","::1","UDP","340","49667  >  49667 Len=288"
"1032","914.249595","::1","::1","PGSQL","115","<T/C/Z"
"1033","914.249711","::1","::1","TCP","64","49674  >  5432 [ACK] Seq=35491 Ack=9283 Win=8360 Len=0"
"1034","919.291352","::1","::1","PGSQL","259",">Q"
"1035","919.291486","::1","::1","TCP","64","5432  >  49674 [ACK] Seq=9283 Ack=35686 Win=8367 Len=0"
"1036","919.292431","::1","::1","UDP","340","49667  >  49667 Len=288"
"1037","919.292622","::1","::1","PGSQL","115","<T/C/Z"
"1038","919.292758","::1","::1","TCP","64","49674  >  5432 [ACK] Seq=35686 Ack=9334 Win=8359 Len=0"
"1039","924.350383","::1","::1","PGSQL","259",">Q"
"1040","924.350525","::1","::1","TCP","64","5432  >  49674 [ACK] Seq=9334 Ack=35881 Win=8367 Len=0"
"1041","924.351411","::1","::1","UDP","340","49667  >  49667 Len=288"
"1042","924.351590","::1","::1","PGSQL","115","<T/C/Z"
"1043","924.351687","::1","::1","TCP","64","49674  >  5432 [ACK] Seq=35881 Ack=9385 Win=8359 Len=0"
"1044","929.415263","::1","::1","PGSQL","259",">Q"
"1045","929.415475","::1","::1","TCP","64","5432  >  49674 [ACK] Seq=9385 Ack=36076 Win=8366 Len=0"
"1046","929.416609","::1","::1","UDP","340","49667  >  49667 Len=288"
"1047","929.416882","::1","::1","PGSQL","115","<T/C/Z"
"1048","929.417042","::1","::1","TCP","64","49674  >  5432 [ACK] Seq=36076 Ack=9436 Win=8359 Len=0"
"1049","934.475767","::1","::1","PGSQL","259",">Q"
"1050","934.475907","::1","::1","TCP","64","5432  >  49674 [ACK] Seq=9436 Ack=36271 Win=8365 Len=0"
"1051","934.476939","::1","::1","UDP","340","49667  >  49667 Len=288"
"1052","934.477178","::1","::1","PGSQL","115","<T/C/Z"
"1053","934.477292","::1","::1","TCP","64","49674  >  5432 [ACK] Seq=36271 Ack=9487 Win=8359 Len=0"
"1054","939.531911","::1","::1","PGSQL","259",">Q"
"1055","939.532078","::1","::1","TCP","64","5432  >  49674 [ACK] Seq=9487 Ack=36466 Win=8364 Len=0"
"1056","939.533269","::1","::1","UDP","340","49667  >  49667 Len=288"
"1057","939.533493","::1","::1","PGSQL","115","<T/C/Z"
"1058","939.533638","::1","::1","TCP","64","49674  >  5432 [ACK] Seq=36466 Ack=9538 Win=8359 Len=0"
"1059","944.590232","::1","::1","PGSQL","259",">Q"
"1060","944.590384","::1","::1","TCP","64","5432  >  49674 [ACK] Seq=9538 Ack=36661 Win=8363 Len=0"
"1061","944.591604","::1","::1","UDP","340","49667  >  49667 Len=288"
"1062","944.591862","::1","::1","PGSQL","115","<T/C/Z"
"1063","944.592037","::1","::1","TCP","64","49674  >  5432 [ACK] Seq=36661 Ack=9589 Win=8358 Len=0"
"1064","949.646433","::1","::1","PGSQL","259",">Q"
"1065","949.646591","::1","::1","TCP","64","5432  >  49674 [ACK] Seq=9589 Ack=36856 Win=8363 Len=0"
"1066","949.647699","::1","::1","UDP","340","49667  >  49667 Len=288"
"1067","949.647929","::1","::1","PGSQL","115","<T/C/Z"
"1068","949.648060","::1","::1","TCP","64","49674  >  5432 [ACK] Seq=36856 Ack=9640 Win=8358 Len=0"
"1069","952.911250","::1","::1","UDP","84","49667  >  49667 Len=32"
"1070","953.112026","::1","::1","UDP","76","49667  >  49667 Len=24"
"1071","953.119864","::1","::1","UDP","84","49667  >  49667 Len=32"
"1072","953.160602","::1","::1","UDP","1012","49667  >  49667 Len=960"
"1073","953.160810","::1","::1","UDP","452","49667  >  49667 Len=400"
"1074","953.160863","::1","::1","UDP","564","49667  >  49667 Len=512"
"1075","954.694853","::1","::1","PGSQL","259",">Q"
"1076","954.694975","::1","::1","TCP","64","5432  >  49674 [ACK] Seq=9640 Ack=37051 Win=8362 Len=0"
"1077","954.695850","::1","::1","UDP","340","49667  >  49667 Len=288"
"1078","954.696033","::1","::1","PGSQL","115","<T/C/Z"
"1079","954.696135","::1","::1","TCP","64","49674  >  5432 [ACK] Seq=37051 Ack=9691 Win=8358 Len=0"
"1080","959.760899","::1","::1","PGSQL","259",">Q"
"1081","959.761058","::1","::1","TCP","64","5432  >  49674 [ACK] Seq=9691 Ack=37246 Win=8361 Len=0"
"1082","959.762073","::1","::1","UDP","340","49667  >  49667 Len=288"
"1083","959.762285","::1","::1","PGSQL","115","<T/C/Z"
"1084","959.762417","::1","::1","TCP","64","49674  >  5432 [ACK] Seq=37246 Ack=9742 Win=8358 Len=0"
"1085","964.821039","::1","::1","PGSQL","259",">Q"
"1086","964.821224","::1","::1","TCP","64","5432  >  49674 [ACK] Seq=9742 Ack=37441 Win=8360 Len=0"
"1087","964.822183","::1","::1","UDP","340","49667  >  49667 Len=288"
"1088","964.822377","::1","::1","PGSQL","115","<T/C/Z"
"1089","964.822519","::1","::1","TCP","64","49674  >  5432 [ACK] Seq=37441 Ack=9793 Win=8358 Len=0"
"1090","969.875697","::1","::1","PGSQL","259",">Q"
"1091","969.875848","::1","::1","TCP","64","5432  >  49674 [ACK] Seq=9793 Ack=37636 Win=8360 Len=0"
"1092","969.876729","::1","::1","UDP","340","49667  >  49667 Len=288"
"1093","969.876972","::1","::1","PGSQL","115","<T/C/Z"
"1094","969.877116","::1","::1","TCP","64","49674  >  5432 [ACK] Seq=37636 Ack=9844 Win=8357 Len=0"
"1095","974.933830","::1","::1","PGSQL","259",">Q"
"1096","974.933995","::1","::1","TCP","64","5432  >  49674 [ACK] Seq=9844 Ack=37831 Win=8359 Len=0"
"1097","974.935404","::1","::1","UDP","340","49667  >  49667 Len=288"
"1098","974.935692","::1","::1","PGSQL","115","<T/C/Z"
"1099","974.935873","::1","::1","TCP","64","49674  >  5432 [ACK] Seq=37831 Ack=9895 Win=8357 Len=0"
"1100","979.994216","::1","::1","PGSQL","259",">Q"
"1101","979.994400","::1","::1","TCP","64","5432  >  49674 [ACK] Seq=9895 Ack=38026 Win=8358 Len=0"
"1102","979.995347","::1","::1","UDP","340","49667  >  49667 Len=288"
"1103","979.995546","::1","::1","PGSQL","115","<T/C/Z"
"1104","979.995685","::1","::1","TCP","64","49674  >  5432 [ACK] Seq=38026 Ack=9946 Win=8357 Len=0"
"1105","985.045208","::1","::1","PGSQL","259",">Q"
"1106","985.045365","::1","::1","TCP","64","5432  >  49674 [ACK] Seq=9946 Ack=38221 Win=8357 Len=0"
"1107","985.046324","::1","::1","UDP","340","49667  >  49667 Len=288"
"1108","985.046537","::1","::1","PGSQL","115","<T/C/Z"
"1109","985.046713","::1","::1","TCP","64","49674  >  5432 [ACK] Seq=38221 Ack=9997 Win=8357 Len=0"
"1110","990.091843","::1","::1","PGSQL","259",">Q"
"1111","990.091984","::1","::1","TCP","64","5432  >  49674 [ACK] Seq=9997 Ack=38416 Win=8357 Len=0"
"1112","990.092898","::1","::1","UDP","340","49667  >  49667 Len=288"
"1113","990.093096","::1","::1","PGSQL","115","<T/C/Z"
"1114","990.093235","::1","::1","TCP","64","49674  >  5432 [ACK] Seq=38416 Ack=10048 Win=8357 Len=0"
"1115","995.137514","::1","::1","PGSQL","259",">Q"
"1116","995.137665","::1","::1","TCP","64","5432  >  49674 [ACK] Seq=10048 Ack=38611 Win=8356 Len=0"
"1117","995.138707","::1","::1","UDP","340","49667  >  49667 Len=288"
"1118","995.138857","::1","::1","PGSQL","115","<T/C/Z"
"1119","995.138978","::1","::1","TCP","64","49674  >  5432 [ACK] Seq=38611 Ack=10099 Win=8356 Len=0"
"1120","1000.195679","::1","::1","PGSQL","259",">Q"
"1121","1000.195801","::1","::1","TCP","64","5432  >  49674 [ACK] Seq=10099 Ack=38806 Win=8355 Len=0"
"1122","1000.196879","::1","::1","UDP","340","49667  >  49667 Len=288"
"1123","1000.197054","::1","::1","PGSQL","115","<T/C/Z"
"1124","1000.197125","::1","::1","TCP","64","49674  >  5432 [ACK] Seq=38806 Ack=10150 Win=8356 Len=0"
"1125","1005.246658","::1","::1","PGSQL","259",">Q"
"1126","1005.246708","::1","::1","TCP","64","5432  >  49674 [ACK] Seq=10150 Ack=39001 Win=8354 Len=0"
"1127","1005.247109","::1","::1","UDP","340","49667  >  49667 Len=288"
"1128","1005.247247","::1","::1","PGSQL","115","<T/C/Z"
"1129","1005.247287","::1","::1","TCP","64","49674  >  5432 [ACK] Seq=39001 Ack=10201 Win=8356 Len=0"
"1130","1010.299990","::1","::1","PGSQL","259",">Q"
"1131","1010.300178","::1","::1","TCP","64","5432  >  49674 [ACK] Seq=10201 Ack=39196 Win=8354 Len=0"
"1132","1010.301342","::1","::1","UDP","340","49667  >  49667 Len=288"
"1133","1010.301543","::1","::1","PGSQL","115","<T/C/Z"
"1134","1010.301614","::1","::1","TCP","64","49674  >  5432 [ACK] Seq=39196 Ack=10252 Win=8356 Len=0"
"1135","1013.024467","::1","::1","UDP","84","49667  >  49667 Len=32"
"1136","1013.183797","::1","::1","UDP","76","49667  >  49667 Len=24"
"1137","1013.203500","::1","::1","UDP","84","49667  >  49667 Len=32"
"1138","1013.269186","::1","::1","UDP","1012","49667  >  49667 Len=960"
"1139","1013.269246","::1","::1","UDP","452","49667  >  49667 Len=400"
"1140","1013.269281","::1","::1","UDP","564","49667  >  49667 Len=512"
"1141","1015.349934","::1","::1","PGSQL","259",">Q"
"1142","1015.349985","::1","::1","TCP","64","5432  >  49674 [ACK] Seq=10252 Ack=39391 Win=8353 Len=0"
"1143","1015.350369","::1","::1","UDP","340","49667  >  49667 Len=288"
"1144","1015.350462","::1","::1","PGSQL","115","<T/C/Z"
"1145","1015.350510","::1","::1","TCP","64","49674  >  5432 [ACK] Seq=39391 Ack=10303 Win=8356 Len=0"
"1146","1020.400233","::1","::1","PGSQL","259",">Q"
"1147","1020.400324","::1","::1","TCP","64","5432  >  49674 [ACK] Seq=10303 Ack=39586 Win=8352 Len=0"
"1148","1020.401142","::1","::1","UDP","340","49667  >  49667 Len=288"
"1149","1020.401325","::1","::1","PGSQL","115","<T/C/Z"
"1150","1020.401418","::1","::1","TCP","64","49674  >  5432 [ACK] Seq=39586 Ack=10354 Win=8355 Len=0"
"1151","1025.454030","::1","::1","PGSQL","259",">Q"
"1152","1025.454144","::1","::1","TCP","64","5432  >  49674 [ACK] Seq=10354 Ack=39781 Win=8351 Len=0"
"1153","1025.454786","::1","::1","UDP","340","49667  >  49667 Len=288"
"1154","1025.454944","::1","::1","PGSQL","115","<T/C/Z"
"1155","1025.455036","::1","::1","TCP","64","49674  >  5432 [ACK] Seq=39781 Ack=10405 Win=8355 Len=0"
"1156","1030.498732","::1","::1","PGSQL","259",">Q"
"1157","1030.498850","::1","::1","TCP","64","5432  >  49674 [ACK] Seq=10405 Ack=39976 Win=8351 Len=0"
"1158","1030.499882","::1","::1","UDP","340","49667  >  49667 Len=288"
"1159","1030.500079","::1","::1","PGSQL","115","<T/C/Z"
"1160","1030.500184","::1","::1","TCP","64","49674  >  5432 [ACK] Seq=39976 Ack=10456 Win=8355 Len=0"
"1161","1035.561651","::1","::1","PGSQL","259",">Q"
"1162","1035.561832","::1","::1","TCP","64","5432  >  49674 [ACK] Seq=10456 Ack=40171 Win=8350 Len=0"
"1163","1035.562978","::1","::1","UDP","340","49667  >  49667 Len=288"
"1164","1035.563245","::1","::1","PGSQL","115","<T/C/Z"
"1165","1035.563386","::1","::1","TCP","64","49674  >  5432 [ACK] Seq=40171 Ack=10507 Win=8355 Len=0"
"1166","1040.614855","::1","::1","PGSQL","259",">Q"
"1167","1040.614992","::1","::1","TCP","64","5432  >  49674 [ACK] Seq=10507 Ack=40366 Win=8349 Len=0"
"1168","1040.616070","::1","::1","UDP","340","49667  >  49667 Len=288"
"1169","1040.616288","::1","::1","PGSQL","115","<T/C/Z"
"1170","1040.616400","::1","::1","TCP","64","49674  >  5432 [ACK] Seq=40366 Ack=10558 Win=8355 Len=0"
"1171","1045.668956","::1","::1","PGSQL","259",">Q"
"1172","1045.669023","::1","::1","TCP","64","5432  >  49674 [ACK] Seq=10558 Ack=40561 Win=8348 Len=0"
"1173","1045.669518","::1","::1","UDP","340","49667  >  49667 Len=288"
"1174","1045.669606","::1","::1","PGSQL","115","<T/C/Z"
"1175","1045.669659","::1","::1","TCP","64","49674  >  5432 [ACK] Seq=40561 Ack=10609 Win=8354 Len=0"
"1176","1050.721382","::1","::1","PGSQL","259",">Q"
"1177","1050.721521","::1","::1","TCP","64","5432  >  49674 [ACK] Seq=10609 Ack=40756 Win=8347 Len=0"
"1178","1050.722662","::1","::1","UDP","340","49667  >  49667 Len=288"
"1179","1050.722868","::1","::1","PGSQL","115","<T/C/Z"
"1180","1050.722971","::1","::1","TCP","64","49674  >  5432 [ACK] Seq=40756 Ack=10660 Win=8354 Len=0"
"1181","1055.774982","::1","::1","PGSQL","259",">Q"
"1182","1055.775091","::1","::1","TCP","64","5432  >  49674 [ACK] Seq=10660 Ack=40951 Win=8347 Len=0"
"1183","1055.775895","::1","::1","UDP","340","49667  >  49667 Len=288"
"1184","1055.776005","::1","::1","PGSQL","115","<T/C/Z"
"1185","1055.776063","::1","::1","TCP","64","49674  >  5432 [ACK] Seq=40951 Ack=10711 Win=8354 Len=0"
"1186","1060.818530","::1","::1","PGSQL","259",">Q"
"1187","1060.818720","::1","::1","TCP","64","5432  >  49674 [ACK] Seq=10711 Ack=41146 Win=8346 Len=0"
"1188","1060.820512","::1","::1","UDP","340","49667  >  49667 Len=288"
"1189","1060.820801","::1","::1","PGSQL","115","<T/C/Z"
"1190","1060.820948","::1","::1","TCP","64","49674  >  5432 [ACK] Seq=41146 Ack=10762 Win=8354 Len=0"
